aw_deep_link,product_name,aw_product_id,merchant_product_id,merchant_image_url,description,merchant_category,search_price,merchant_name,merchant_id,category_id,aw_image_url,store_price,delivery_cost,display_price,ean,isbn,upc,mpn,parent_product_id,product_GTIN
https://www.awin1.com/pclick.php?p=33125871007&a=87679&m=5923,"Ribble Endurance SL R Frameset",33125871007,BDENDSLRBLA,https://checkout.ribblecycles.co.uk/media/catalog/product/e/n/endurance_slr_frame.png,"PRO LEVEL ENDURANCE   RIDING &amp;amp; RACINGThe SL R frameset is manufactured from a carefully selected blend of Toray&amp;rsquo;s carbon using more of the T1000 grade than the standard SL and layered to an exacting specification to reduce weight without compromising stiffness and strength. The frame is crafted using advanced monocoque mould technology incorporating an EPS inner core system which ensures complete consistency of the structural integrity of the fibres and resin throughout the frame. This system also eliminates excess material on the inside of the frame.  Full  SpecificationFrame: Toray T1000/T800 full carbon fibre monocoque.Colour: Raw carbon.Fork: Toray T1000/T800 full carbon fibre monocoque.Headset: 1.5 top &amp;amp; bottom.Brake Fitment: Direct mount rim caliper.Cable Routing: Internal, including Di2 compatibility.Front Derailleur Mount: Braze-on.Bottom Bracket: Press Fit BB86.Seat Clamp:  Integrated wedge system.Tyre Clearance: 28mm without mudguards fitted, 25mm with mudguards.Mudguard Compatible. Yes.Axles: Quick release, 9mm.Sizes: XS, S, M, L, XL.Raw Frame Weight: 850g - Forks 450g - Seatpost 183g +/- 5g",Cycling,1799.00,"Ribble Cycles",5923,252,https://images2.productserve.com/?w=200&h=200&bg=white&trim=5&t=letterbox&url=ssl%3Acheckout.ribblecycles.co.uk%2Fmedia%2Fcatalog%2Fproduct%2Fe%2Fn%2Fendurance_slr_frame.png&feedId=5923&k=acfb6d200210f1f2f57a40fb32d7ba0046a28b5e,,15.00,GBP1799.00,,,,,,
https://www.awin1.com/pclick.php?p=33125871009&a=87679&m=5923,"Ribble Endurance SL R Disc Frameset",33125871009,BDENDSLRDBL,https://checkout.ribblecycles.co.uk/media/catalog/product/e/n/endurance_slr_disc-frameset.png,"ENDURANCE   &amp;amp; PERFORMANCE The SL R frameset is manufactured from a carefully selected blend of Toray&amp;rsquo;s carbon using more of the T1000 grade than the standard SL and layered to an exacting specification to reduce weight without compromising stiffness and strength. The frame is crafted using advanced monocoque mould technology incorporating an EPS inner core system which ensures complete consistency of the structural integrity of the fibres and resin throughout the frame. This system also eliminates excess material on the inside of the frame.  Full  SpecificationFrame: Toray T1000/T800 full carbon fibre monocoque.Colour: Raw Carbon.Fork: Toray T1000/T800 full carbon fibre monocoque.Headset: 1.5 Top &amp;amp; bottom.Brake Fitment: Flat mount disc.Cable Routing: Internal, including Di2 compatibility.Front Derailleur Mount: Braze-On.Bottom Bracket: Press fit BB86.Seat Clamp:  Integrated wedge system.Tyre Clearance: *32mm without mudguards fitted, 25mm with mudguards.Mudguard Compatible. Yes.Thru-Axles: 100/122/M12*P1.5 Front - 142/173/M12*P1.5 Rear.Sizes: XS, S, M, L, XL.Raw Frame Weight: 890g (med) - Forks 450g - Seatpost 183g +/- 5g.*Manufacturer dependent.",Cycling,1899.00,"Ribble Cycles",5923,252,https://images2.productserve.com/?w=200&h=200&bg=white&trim=5&t=letterbox&url=ssl%3Acheckout.ribblecycles.co.uk%2Fmedia%2Fcatalog%2Fproduct%2Fe%2Fn%2Fendurance_slr_disc-frameset.png&feedId=5923&k=37b9298e9dc46b1496649a5ae1a2d87115ae4b94,,15.00,GBP1899.00,,,,,,
https://www.awin1.com/pclick.php?p=33125871011&a=87679&m=5923,"Ribble CGR SL Frameset",33125871011,BDCGRSLCFRS,https://checkout.ribblecycles.co.uk/media/catalog/product/c/g/cgr_sl_frameset.png,"MASTER OF    ALL TRADESDesigned with meticulous attention to detail to handle the toughest roads, terrain and weather conditions, and built around a state of the art Carbon fibre frame. Compatible with multiple wheel and tyre options, and a wide array of customisation options to build into a superlight Sunday best road bike, the complete Adventure bike, or the ultimate daily commuter.SpecificationsFrame: Toray T800/1000 full carbon fibre monocoque.Colour: Blue with sky blue &amp; white accents.Fork:  Full carbon fibre monocoque, tapered steerer.Headset: 1.5 top &amp;amp; bottomBrake Fitment: Flat mount.Cable Routing: Internal.Front Derailleur Mount: Braze-on.Bottom Bracket:  Threaded BSA 68mm.Seatpost:  Ribble SL Carbon, 5mm offset. Seatclamp:  Integrated wedge system.Mudguard compatible: Removable bridge required (available separately).Tyre Clearance: 45mm on 700c wheels, 47mm on 650b.Thr-Axles:  100/122/M12*P1.5 Front - 142/173/M12*P1.5 Rear.Sizes: XS, S, M, L, XL.Raw Frame weight: 1150g, Forks 450g +/-5g.",Cycling,1299.00,"Ribble Cycles",5923,252,https://images2.productserve.com/?w=200&h=200&bg=white&trim=5&t=letterbox&url=ssl%3Acheckout.ribblecycles.co.uk%2Fmedia%2Fcatalog%2Fproduct%2Fc%2Fg%2Fcgr_sl_frameset.png&feedId=5923&k=3b6b87fb5d8ee1e39068da5f482a838be823fc05,,15.00,GBP1299.00,,,,,,
https://www.awin1.com/pclick.php?p=33125871013&a=87679&m=5923,"Ribble Endurance SL Disc Frameset - Red",33125871013,BDENDSLDRED,https://checkout.ribblecycles.co.uk/media/catalog/product/e/n/endurance-sl-disc-red-frameset.png,"ENDURANCE    &amp;amp; PERFORMANCEThe new Ribble Endurance SL Disc is a superlight road platform designed for Endurance riding and racing. With a carefully considered geometry resulting in a frameset that offers stability, comfort and precision handling with enough adjustability to suit both endurance riders and those looking for a more performance optimised riding position. The shape and design of every tube profile and intersection is there for a reason all contributing to the overall performance and ride feel you get from the SL platform.  Full  SpecificationFrame: Toray T800/T1000 full carbon fibre monocoque.Colour: Red with black &amp;amp; white accents.Fork: Toray T800/T100 full carbon fibre monocoque.Headset: 1.5 top &amp;amp; bottom.Brake Fitment: Flat mount disc.Cable Routing: Internal, including Di2 compatibility.Front Derailleur Mount: Braze-on.Bottom Bracket: Threaded BSA 68mm.Seat Clamp:  Integrated wedge system.Tyre Clearance: *32mm without mudguards, 25mm with mudguards fitted.Mudguard Compatible. Yes.Thru-Axles: 100/122/M12*P1.5 front - 142/173/M12*P1.5 rear.Sizes: XS, S, M, L, XL.Raw Frame Weight: 1150g - Forks 470g - Seatpost 183g +/- 5g.* Manufacturer dependant.",Cycling,1399.00,"Ribble Cycles",5923,252,https://images2.productserve.com/?w=200&h=200&bg=white&trim=5&t=letterbox&url=ssl%3Acheckout.ribblecycles.co.uk%2Fmedia%2Fcatalog%2Fproduct%2Fe%2Fn%2Fendurance-sl-disc-red-frameset.png&feedId=5923&k=2a558efcb50b75fc5b20e8c40fb0f5332a26f7d6,,15.00,GBP1399.00,,,,,,
https://www.awin1.com/pclick.php?p=33125871015&a=87679&m=5923,"Ribble Endurance SL Frameset - Black",33125871015,BDENDSLCBLA,https://checkout.ribblecycles.co.uk/media/catalog/product/e/n/endurance_sl_black_frameset.png,"ENDURANCE   &amp;amp; PERFORMANCEThe Ribble Endurance SL is an award winning, superlight road platform designed for Endurance riding and racing. With a carefully considered geometry resulting in a frameset that offers stability, comfort and precision handling with enough adjustability to suit both endurance riders and those looking for a more performance optimised riding position. The shape and design of every tube profile and intersection is there for a reason all contributing to the overall performance and ride feel you get from the SL platform.  Full  SpecificationFrame: Toray T800/T1000 full carbon fibre monocoque.Colour: Black with anthracite &amp;amp; silver accents.Fork: Toray T800/T1000 full carbon fibre monocoque.Headset: 1.5 top &amp;amp; bottom.Brake Fitment: Direct mount rim caliper.Cable Routing: Internal including Di2 compatibility.Front Derailleur Mount: Braze-on.Bottom Bracket: Threaded BSA 68mm.Seat Clamp:  Integrated wedge system.Tyre Clearance: 28mm without mudguards fitted, 25mm with guards.Mudguard Compatible. Axles: Quick release, 9mm.Sizes: XS, S, M, L, XL.Raw Frame Weight: 1150g - Forks 450g - Seatpost 183g +/- 5g.",Cycling,1399.00,"Ribble Cycles",5923,252,https://images2.productserve.com/?w=200&h=200&bg=white&trim=5&t=letterbox&url=ssl%3Acheckout.ribblecycles.co.uk%2Fmedia%2Fcatalog%2Fproduct%2Fe%2Fn%2Fendurance_sl_black_frameset.png&feedId=5923&k=0e1064ee6253ca4fdcf825b571e8da96e064757a,,15.00,GBP1399.00,,,,,,
https://www.awin1.com/pclick.php?p=33125871017&a=87679&m=5923,"Ribble Endurance SL Disc Frameset - Black",33125871017,BDENDSLDBLA,https://checkout.ribblecycles.co.uk/media/catalog/product/e/n/endurance-sl-disc-black-frameset.png,"ENDURANCE    &amp;amp; PERFORMANCEThe award winning Ribble Endurance SL Disc is a superlight road platform designed for Endurance riding and racing. With a carefully considered geometry resulting in a frameset that offers stability, comfort and precision handling with enough adjustability to suit both endurance riders and those looking for a more performance optimised riding position. The shape and design of every tube profile and intersection is there for a reason all contributing to the overall performance and ride feel you get from the SL platform.  Full  SpecificationFrame: Toray T800/T1000 full carbon fibre monocoque.Colour: Gloss black with sky blue &amp;amp; grey accents.Fork: Toray T800/T1000 full carbon fibre monocoque.Headset: 1.5 top &amp;amp; bottom.Brake Fitment: Flat mount disc.Cable Routing: Internal, including Di2 compatibility.Front Derailleur Mount: Braze-on.Bottom Bracket: Threaded BSA 68mm.Seat Clamp:  Integrated wedge system.Tyre Clearance: *32mm without mudguards fitted, 25mm with mudguards.Mudguard Compatible. Yes.Thru-Axles: 100/122/M12*P1.5 front - 142/173/M12*P1.5 rear.Sizes: XS, S, M, L, XL.Raw Frame Weight: 1150g (med) - Forks 470g - Seatpost 183g +/- 5g.",Cycling,1399.00,"Ribble Cycles",5923,252,https://images2.productserve.com/?w=200&h=200&bg=white&trim=5&t=letterbox&url=ssl%3Acheckout.ribblecycles.co.uk%2Fmedia%2Fcatalog%2Fproduct%2Fe%2Fn%2Fendurance-sl-disc-black-frameset.png&feedId=5923&k=ddb9f59d51c502ce623f2c1ad20bd8ea90019612,,15.00,GBP1399.00,,,,,,
https://www.awin1.com/pclick.php?p=33125871019&a=87679&m=5923,"Ribble Endurance SL Disc Frameset - Teal",33125871019,BDENDSLDTEA,https://checkout.ribblecycles.co.uk/media/catalog/product/t/e/teal_105_side_on_1_.png,"EMDURANCE   &amp;amp; PERFORMANCEThe award winning Ribble Endurance SL Disc is a superlight road platform designed for Endurance riding and racing. With a carefully considered geometry resulting in a frameset that offers stability, comfort and precision handling with enough adjustability to suit both endurance riders and those looking for a more performance optimised riding position. The shape and design of every tube profile and intersection is there for a reason all contributing to the overall performance and ride feel you get from the SL platform.  Full  SpecificationFrame: Toray T800/T1000 full carbon fibre monocoque.Colour: Teal with anthracite &amp;amp; white accents.Forks: Toray T800/T1000 full carbon fibre monocoque.Headset: 1.5 top &amp;amp; bottom.Brake Fitment: Flat mount disc.Cable Routing: Internal, including Di2 compatibility.Front Derailleur Mount: Braze-on.Bottom Bracket: Threaded BSA 68mm.Seat Clamp: Integrated wedge system.Tyre Clearance: *32mm without mudguards fitted, 25mm with mudguards.Mudguard Compatible. Yes.Thru-Axles: 100/122/M12*P1.5 front - 142/173/M12*P1.5 rear.Sizes: XS, S, M, L, XL.Raw Frame Weight: 1050g (med) - Forks 450g - Seatpost 183g +/- 5g.*Manufacturer dependant",Cycling,1399.00,"Ribble Cycles",5923,252,https://images2.productserve.com/?w=200&h=200&bg=white&trim=5&t=letterbox&url=ssl%3Acheckout.ribblecycles.co.uk%2Fmedia%2Fcatalog%2Fproduct%2Ft%2Fe%2Fteal_105_side_on_1_.png&feedId=5923&k=471701623ba82aa5ce8be61b23092b1a35ba3fe4,,15.00,GBP1399.00,,,,,,
https://www.awin1.com/pclick.php?p=33125871021&a=87679&m=5923,"Ribble HT Ti - Sport",33125871021,BBMTBTI0004,https://checkout.ribblecycles.co.uk/media/catalog/product/h/t/ht_ti_nx_wtb_side_view.png,"The HT Ti with SRAM NX Eagle offers incredible performance and durability with compliance that can only be experienced from a premium Titanium frame. NX Eagle provides a doorway into the Eagle range which is the best performing and lightest 1x12 series on the market today. Matched with a RockShox Revelation RC fork, LEVEL 35 wheels and Level XI bar and stem, plus a LEVEL 150mm dropper seat post, it's a real trail-shredder.",Cycling,2299.00,"Ribble Cycles",5923,252,https://images2.productserve.com/?w=200&h=200&bg=white&trim=5&t=letterbox&url=ssl%3Acheckout.ribblecycles.co.uk%2Fmedia%2Fcatalog%2Fproduct%2Fh%2Ft%2Fht_ti_nx_wtb_side_view.png&feedId=5923&k=c95c1a68be57b112c797ae93ceeb097b36cba651,,40.00,GBP2299.00,,,,,,
https://www.awin1.com/pclick.php?p=33125871023&a=87679&m=5923,"Ribble HT 725 Frameset",33125871023,BBMTB725004,https://checkout.ribblecycles.co.uk/media/catalog/product/h/t/ht_725_frame_only.png,"MODERN REYNOLDS   STEEL HARDTAILThe HT 725 is a serious hardcore hardtail that boasts a slack 64° head angle matched to a long top tube and short stem to hit the sweet spot for handling. 150mm of travel up front and the awesome durability and compliance of a Reynolds 725 steel frame ensures a planted feel at high speeds and when carving it up through corners. A generous tyre clearance makes this a super capable hardtail that’s efficient on the climbs and descends like a dream too.Tech details include fully internally routed cabling for additional cable protection and cleaner lines and gussets to provide extra strength.  Full  SpecificationFrame: Reynolds 725 steel, triple-butted.Colour: Grey with a choice of decal colours .Headset: 1.5x1.5, 44mm external cup.Brake Fitment: Flat mount disc.Cable Routing: Internal, including dropper post routing.Bottom Bracket: Threaded BSA 73mm.Seatpost Diameter: 30.9mm.Seat Clamp: 34.9mm, available in a choice of colours.Tyre Clearance: 2.6.Rear Thru-Axle: 148/178/M12*P1.5.Sizes: S, M, L, XL.Raw Frame Weight: 2920g (med).Warranty: 3-years.",Cycling,799.00,"Ribble Cycles",5923,252,https://images2.productserve.com/?w=200&h=200&bg=white&trim=5&t=letterbox&url=ssl%3Acheckout.ribblecycles.co.uk%2Fmedia%2Fcatalog%2Fproduct%2Fh%2Ft%2Fht_725_frame_only.png&feedId=5923&k=027c01a2e991d8aa8ccbad1be9947c3180a9af65,,15.00,GBP799.00,,,,,,
https://www.awin1.com/pclick.php?p=33125871025&a=87679&m=5923,"Ribble Endurance SL e",33125871025,BBENDCAN000,https://checkout.ribblecycles.co.uk/media/catalog/product/e/n/endurance_sle_di2__side_angled_2.png,"E-BIKEPreviously unimaginable mountain passes, struggling to keep up on hilly group rides and the routes that take you outside your comfort zone are now in the past - Make it possible with the Ribble Endurance SL e.",Cycling,2999.00,"Ribble Cycles",5923,252,https://images2.productserve.com/?w=200&h=200&bg=white&trim=5&t=letterbox&url=ssl%3Acheckout.ribblecycles.co.uk%2Fmedia%2Fcatalog%2Fproduct%2Fe%2Fn%2Fendurance_sle_di2__side_angled_2.png&feedId=5923&k=2342af76327ae5ab9ebb2d046529f005a3f032fb,,40.00,GBP2999.00,,,,,,
https://www.awin1.com/pclick.php?p=33125871027&a=87679&m=5923,"Ribble CGR AL",33125871027,BBCGRABL000,https://checkout.ribblecycles.co.uk/media/catalog/product/c/g/cgr_al_blue_ultegra__side_on_1.png,"ALL TERRAINALL SEASON VERSATILITYThe CGR AL is an incredibly versatile platform that will take you anywhere with capable performance and striking style.  With a comfortable geometry and impressive tyre clearance it’s built to excel over a variety of terrains. Compatibility with multiple wheel sizes opens up a vast choice of tyre options that can be tailored to suit any chosen terrain, rear pannier rack and mudguard mounts result in a bike capable of taking on the worst of conditions over varied terrain.",Cycling,1399.00,"Ribble Cycles",5923,252,https://images2.productserve.com/?w=200&h=200&bg=white&trim=5&t=letterbox&url=ssl%3Acheckout.ribblecycles.co.uk%2Fmedia%2Fcatalog%2Fproduct%2Fc%2Fg%2Fcgr_al_blue_ultegra__side_on_1.png&feedId=5923&k=8b79da5d7f03f2a8ab9850654b8656a957a8591a,,40.00,GBP1399.00,,,,,,
https://www.awin1.com/pclick.php?p=33125871029&a=87679&m=5923,"Ribble CGR AL",33125871029,BBCGRAOR000,https://checkout.ribblecycles.co.uk/media/catalog/product/c/g/cgr_al_orange_ultegra_side_on_1.png,"Light and robust the CGR Alloy is a stunning bike that will take you anywhere with timeless performance and style. Strong, versatile and durable, the geometry of the hand built, British-designed CGR Alloy has been carefully formulated so that it conquers all riding surfaces with ease.",Cycling,1399.00,"Ribble Cycles",5923,252,https://images2.productserve.com/?w=200&h=200&bg=white&trim=5&t=letterbox&url=ssl%3Acheckout.ribblecycles.co.uk%2Fmedia%2Fcatalog%2Fproduct%2Fc%2Fg%2Fcgr_al_orange_ultegra_side_on_1.png&feedId=5923&k=71760c28a790da0ebd6d0535dfcbc76f46052686,,40.00,GBP1399.00,,,,,,
https://www.awin1.com/pclick.php?p=33125871031&a=87679&m=5923,"Ribble Endurance SL",33125871031,BBROADCC000,https://checkout.ribblecycles.co.uk/media/catalog/product/e/n/endurance_sl_black_pro_11_speed_di2_side_on_1_1.png,"The Endurance SL is a superlight carbon road platform designed for endurance riding and racing.  This world class frame climbs, corners and descends with unbeatable efficiency and control.",Cycling,1899.00,"Ribble Cycles",5923,252,https://images2.productserve.com/?w=200&h=200&bg=white&trim=5&t=letterbox&url=ssl%3Acheckout.ribblecycles.co.uk%2Fmedia%2Fcatalog%2Fproduct%2Fe%2Fn%2Fendurance_sl_black_pro_11_speed_di2_side_on_1_1.png&feedId=5923&k=6a5343dc411c9f8ca7b4fcaef00a4ebc2d98cf3c,,40.00,GBP1899.00,,,,,,
https://www.awin1.com/pclick.php?p=33125871033&a=87679&m=5923,"Ribble Endurance Ti Disc",33125871033,BBENTIDI000,https://checkout.ribblecycles.co.uk/media/catalog/product/e/n/endurance_ti_disc_probuild_side_on_x1000_lighter.png,"Experience the timeless looks and performance of the sleek, road-focused Endurance Titanium. With unparalleled durability and exceptional compliance its the ultimate titanium experience and dares you to ride it to the limit and maybe, just maybe beyond.",Cycling,2499.00,"Ribble Cycles",5923,252,https://images2.productserve.com/?w=200&h=200&bg=white&trim=5&t=letterbox&url=ssl%3Acheckout.ribblecycles.co.uk%2Fmedia%2Fcatalog%2Fproduct%2Fe%2Fn%2Fendurance_ti_disc_probuild_side_on_x1000_lighter.png&feedId=5923&k=e8df4c7fc39cc3dbca314f5aed5549898e633d6d,,40.00,GBP2499.00,,,,,,
https://www.awin1.com/pclick.php?p=33125871035&a=87679&m=5923,"Ribble Endurance Ti Disc - Sport",33125871035,BBENTIDI010,https://checkout.ribblecycles.co.uk/media/catalog/product/e/n/endurance_ti_105_sport_side_on.png,"TITANIUM INSPIRED      PERFORMANCEDesigned for endurance riding and racing the wonderfully fast and compliant Endurance Ti Sport build is matched with Shimano’s 105 groupset. The entry point into 11-speed shifting,105 has established itself as a market leader, in no small part, thanks to its exceptionally smooth, precision shifting performance and incredible value. Shimano 105 hydraulic disc brakes provide powerful and controlled braking whatever the conditions. Mavic’s ever-reliable Aksium wheelset, puncture-resistant Continental Grand Prix GT tyres and mounts for the fitting of full-coverage mudguards guarantee all season ride-ability.",Cycling,2499.00,"Ribble Cycles",5923,252,https://images2.productserve.com/?w=200&h=200&bg=white&trim=5&t=letterbox&url=ssl%3Acheckout.ribblecycles.co.uk%2Fmedia%2Fcatalog%2Fproduct%2Fe%2Fn%2Fendurance_ti_105_sport_side_on.png&feedId=5923&k=839c5df48444b972129bec5cb2b32153ceeddd59,,40.00,GBP2499.00,,,,,,
https://www.awin1.com/pclick.php?p=33125871037&a=87679&m=5923,"Ribble Endurance Ti Disc - Pro",33125871037,BBENTIDI012,https://checkout.ribblecycles.co.uk/media/catalog/product/e/n/endurance_ti_disc_probuild_side_on_x1000_lighter_3.png,"TITANIUM INSPIRED PERFORMANCE      Designed for endurance riding and racing, the seriously fast and wonderfully compliant Endurance Ti Disc simply devours the big miles. This pro-level build comes equipped with wireless electronic shifting precision of Shimano’s latest Ultegra Di2 2x12 transmission, strong and lightweight LEVEL DB40 carbon wheels fitted with Continental’s iconic GP5000 all-rounder race tyres and a full carbon finishing kit from LEVEL.",Cycling,4299.00,"Ribble Cycles",5923,252,https://images2.productserve.com/?w=200&h=200&bg=white&trim=5&t=letterbox&url=ssl%3Acheckout.ribblecycles.co.uk%2Fmedia%2Fcatalog%2Fproduct%2Fe%2Fn%2Fendurance_ti_disc_probuild_side_on_x1000_lighter_3.png&feedId=5923&k=8294a976393b928a55656e547af1d16585621d8f,,40.00,GBP4299.00,,,,,,
https://www.awin1.com/pclick.php?p=33125871039&a=87679&m=5923,"Ribble CGR Ti",33125871039,BBCGTIV3000,https://checkout.ribblecycles.co.uk/media/catalog/product/c/g/cgr_ti_pro_side_on_1.png,"Versatility is at the core of the CGR range and this titanium model certainly ticks all the boxes. The relaxed and stable CGR Ti is ready to ride on a wide range of terrains.",Cycling,2499.00,"Ribble Cycles",5923,252,https://images2.productserve.com/?w=200&h=200&bg=white&trim=5&t=letterbox&url=ssl%3Acheckout.ribblecycles.co.uk%2Fmedia%2Fcatalog%2Fproduct%2Fc%2Fg%2Fcgr_ti_pro_side_on_1.png&feedId=5923&k=7c424d59e8db53dbc3cac0ce67f75b54dbf850f5,,40.00,GBP2499.00,,,,,,
https://www.awin1.com/pclick.php?p=33125871041&a=87679&m=5923,"Ribble CGR Ti Frame",33125871041,BDFSCGRTI03,https://checkout.ribblecycles.co.uk/media/catalog/product/c/g/cgr_ti_frame_only_side_on_1.png,"CGR Ti    FramesetThe CGR Ti is hugely capable and certainly ticks all the boxes when it comes to multi-terrain versatility. Beneath the sleek and graceful lines of the beautifully crafted Titanium frameset beats the heart of a thoroughbred racer coursing through its veins. Albeit, one that benefits from a less aggressive geometry which further enhances that ultimate titanium ride experience that is perfect for eating up the miles on those paved or unpaved rides. Perfectly poised and comfortable, the CGR Ti provides an exhilarating ride over testing terrain and can effortlessly keep pace with the best of them when a ride hits the tarmac. Additional versatility is provided by the addition of rear pannier mounts for any luggage carrying needs and discreet mudguards mounts for full wet weather protection. Thus, allowing the CGR Ti to excel as light tourer our luxurious all-season commuter.  Full  SpecificationFrame: 3Al/2.5V Titanium, triple-butted, seamless welds.Colour: High polish titanium with brushed detail finish.Fork: Full carbon fibre monocoque, tapered steerer.Headset: LEVEL 44, available in your choice of colour.Brake Fitment: Flat mount disc.Cable Routing: Internal, including Di2 compatibility.Front Derailleur Mount: Band-on 31.8mm.Bottom Bracket: Threaded BSA 68mm.Seatpost Diameter: 27.2mm.Seat Clamp: 31.8mm.Tyre Clearance: 47mm with 650b wheels, 45mm with 700c wheels.Mudguard Compatible. Yes.Thru-Axles: 100/122/M12*P1.5 front - 142/167/M12*P1.75 rear.Sizes: XS. S, M, L, XL.Raw Frame Weight: 1600g (med) - Forks 470g +/- 5g.",Cycling,1999.00,"Ribble Cycles",5923,252,https://images2.productserve.com/?w=200&h=200&bg=white&trim=5&t=letterbox&url=ssl%3Acheckout.ribblecycles.co.uk%2Fmedia%2Fcatalog%2Fproduct%2Fc%2Fg%2Fcgr_ti_frame_only_side_on_1.png&feedId=5923&k=2ccc6d71047ce6a8633cfb4b62f857cf36d848f5,,15.00,GBP1999.00,,,,,,
https://www.awin1.com/pclick.php?p=33125871043&a=87679&m=5923,"Ribble Endurance Ti Frameset",33125871043,BDFSENDTI01,https://checkout.ribblecycles.co.uk/media/catalog/product/e/n/enduranceti_frameonly_side_on.png,"TIMELESS LOOKS    &amp;amp; PERFORMANCEThe Endurance Ti is a modern Titanium masterpiece that perfectly blends the classic styling and luxurious ride feel of Titanium with modern design features. It’s handcrafted from the finest grade 3al/2.5v titanium with seamless welds and triple-butted for unmatched strength, performance and longevity. Oversized tube profiles and a dropped seatstay geometry improve horizontal stiffness and power transfer while offering more compliance through vibration absorption. An elegant and robust 44mm headtube, tapered fork steerer and fork profile ensure that front-end stiffness is taken care of and internally routed cables help preserves the frames clean lines. Riders of all experience and ability can benefit from a road-focused endurance geometry that offers just the right balance of handling, stability and comfort. Helping to reduce rider fatigue, improve efficiency and allow allowing you to ride faster, further and for longer.  Full  SpecificationFrame: 3Al/2.5V Titanium, triple-butted, seamless welds. Colour: High polish titanium with brushed detail finish.Fork: Full carbon fibre monocoque, tapered steerer.Headset: LEVEL 44 (Available in a choice of colours).Brake Fitment: Flat mount disc.Cable Routing: Internal, including Di2 compatibility.Front Derailleur Mount: Band-on 31.8mm.Bottom Bracket: Threaded BSA 68mm.Seatpost Diameter: 27.2mm.Seatclamp:  31.8mm.Tyre Clearance: *32mm without mudguards fitted, 25mm with mudguards.Mudguard Compatible. Yes.Thru-Axles: 100/122/M12*P1.5 front - 142/173/M12*P1.5 rear.Sizes: XS, S, M, L, XL.Raw Frame Weight: 1770g (med) - Fork 470g +/- 5g.*Manufacturer dependant",Cycling,1999.00,"Ribble Cycles",5923,252,https://images2.productserve.com/?w=200&h=200&bg=white&trim=5&t=letterbox&url=ssl%3Acheckout.ribblecycles.co.uk%2Fmedia%2Fcatalog%2Fproduct%2Fe%2Fn%2Fenduranceti_frameonly_side_on.png&feedId=5923&k=30fecf0f92dfd63b4c7e8bf06ab196e13b4b1357,,15.00,GBP1999.00,,,,,,
