aw_deep_link,product_name,aw_product_id,merchant_product_id,merchant_image_url,description,merchant_category,search_price,merchant_name,merchant_id,category_id,aw_image_url,store_price,delivery_cost,display_price,ean,isbn,upc,mpn,parent_product_id,product_GTIN
https://www.awin1.com/pclick.php?p=31363123507&a=87679&m=5923,"Ribble Gravel Ti - Enthusiast",31363123507,BBGRAVTI006,https://checkout.ribblecycles.co.uk/media/catalog/product/g/r/gravel_ti_sram_rival_axs_side_on_x1000_1.png,"GRAVEL    MADE EASYThe Gravel Ti’s timeless looks, impeccable performance and rugged durability gives you the freedom to confidently explore the toughest terrain. This ultra-capable performance package features the latest XPLR edition of SRAM’s ground-breaking and fully wireless Rival eTap AXS 1x12 speed gear system, lightweight yet robust Mavic Allroad 650b wheels fitted with traction enabling Halo GXC Gravel 650bx47mm tyres and a gravel-optimised finishing kit for a comfortably confident ride, wherever your travels may take you.",Cycling,3299.00,"Ribble Cycles",5923,252,https://images2.productserve.com/?w=200&h=200&bg=white&trim=5&t=letterbox&url=ssl%3Acheckout.ribblecycles.co.uk%2Fmedia%2Fcatalog%2Fproduct%2Fg%2Fr%2Fgravel_ti_sram_rival_axs_side_on_x1000_1.png&feedId=5923&k=b061ddac9eb51cf50cf8f74f785c98a081066737,,40.00,GBP3299.00,,,,,,
https://www.awin1.com/pclick.php?p=25703717559&a=87679&m=5923,"Ribble CGR AL - Gravel",25703717559,BBCGRABL140,https://checkout.ribblecycles.co.uk/media/catalog/product/c/g/cgr_alloy_apex_1x_side_3-web_5.png,"TAKE THE ROAD    LESS TRAVELLEDStrong, robust, and highly versatile, the CGR AL is designed to conquer all riding surfaces with ease. It comes fully equipped with the gravel-optimised, single ring simplicity of Shimano's GRX RX600 1x11 speed shift system, all-terrain capable Mavic Aksium 700c wheels fitted with multi-purpose Schwalbe G-One tubeless-ready tyres and a lightweight alloy finishing kit that includes flared handlebars for confident control, whatever the terrain.",Cycling,1899.00,"Ribble Cycles",5923,252,https://images2.productserve.com/?w=200&h=200&bg=white&trim=5&t=letterbox&url=ssl%3Acheckout.ribblecycles.co.uk%2Fmedia%2Fcatalog%2Fproduct%2Fc%2Fg%2Fcgr_alloy_apex_1x_side_3-web_5.png&feedId=5923&k=a61509dc0ec9be627383a17c923b4b669256db80,,40.00,GBP1899.00,,,,,,
https://www.awin1.com/pclick.php?p=25864026481&a=87679&m=5923,"Ribble CGR AL - Gravel",25864026481,BBCGRAOR140,https://checkout.ribblecycles.co.uk/media/catalog/product/c/g/cgr_al_grx650_orange_side_on.png,"TAKE THE ROAD    LESS TRAVELLEDStrong, robust, and highly versatile, the CGR AL is designed to conquer all riding surfaces with ease. It comes fully equipped with the gravel-optimised, single ring simplicity of Shimano's GRX RX600 1x11 speed shift system, all-terrain capable Mavic Aksium 700c wheels fitted with multi-purpose Schwalbe G-One tubeless-ready tyres and a lightweight alloy finishing kit that includes flared handlebars for confident control, whatever the terrain.",Cycling,1899.00,"Ribble Cycles",5923,252,https://images2.productserve.com/?w=200&h=200&bg=white&trim=5&t=letterbox&url=ssl%3Acheckout.ribblecycles.co.uk%2Fmedia%2Fcatalog%2Fproduct%2Fc%2Fg%2Fcgr_al_grx650_orange_side_on.png&feedId=5923&k=62261a6cac30fbbc21d6d23aa2141fc0cc48fdbf,,40.00,GBP1899.00,,,,,,
https://www.awin1.com/pclick.php?p=27133908373&a=87679&m=5923,"Ribble CGR 725 - Gravel",27133908373,BBCGR725024,https://checkout.ribblecycles.co.uk/media/catalog/product/c/g/cgr_725_700_side_on.png,"DESIGNED FOR ADVENTURE     &amp; PERFORMANCEBuilt around the elegant, ride smoothing, and rugged Reynolds 725 steel frameset is a package that is designed to maximise the CGR 725’s off-road credentials. This gravel optimised edition features the precision shifts and off-road ergonomics of Shimano’s RX600 gravel dedicated groupset while powerful hydraulic disc brakes offer complete braking confidence in all conditions. Keeping things rolling smoothly over variable surfaces are a set of Mavic Aksium Disc wheels fitted with plush WTB Riddler 45mm tyres which offer supreme comfort and traction over loose and hardpack surfaces.With the CGR 725's generous tyre clearance and the additional versatility provided by the compatibility with mudguards and a rear mounted pannier rack the CGR 725 excels as an all-terrain commuter, light tourer or gravel crusher.",Cycling,2099.00,"Ribble Cycles",5923,252,https://images2.productserve.com/?w=200&h=200&bg=white&trim=5&t=letterbox&url=ssl%3Acheckout.ribblecycles.co.uk%2Fmedia%2Fcatalog%2Fproduct%2Fc%2Fg%2Fcgr_725_700_side_on.png&feedId=5923&k=1ccfc99f8182dc15cab3d9a9188001f72df31aa1,,40.00,GBP2099.00,,,,,,
https://www.awin1.com/pclick.php?p=29805729009&a=87679&m=5923,"Ribble Gravel SL - Pro",29805729009,BBGRAVSL003,https://checkout.ribblecycles.co.uk/media/catalog/product/g/r/gravel_sl_pro_side_on_1.png,"PRO-LEVEL     GRAVEL RACERFor the serious gravel racer for views every gravel ride as an opportunity to charge down trails at blistering speeds there is the Pro edition. We have carefully selected high-end components with weight-saving characteristics which further enhance the Gravel SL’s gravel racer credentials. Including the electronic shifting precision and gravel-specific ergonomics of Shimano’s GRX815 Di2 gear system, lightweight and tubeless-ready LEVEL DB650 Carbon Sport wheels fitted with chunky WTB Sendero 47mm tyres and a premium finishing kit that includes the drag-saving LEVEL 5 carbon integrated handlebar system for super-clean, cable-free aesthetics and flared drops for enhanced control and confidence over even the most extreme of terrains.",Cycling,4299.00,"Ribble Cycles",5923,252,https://images2.productserve.com/?w=200&h=200&bg=white&trim=5&t=letterbox&url=ssl%3Acheckout.ribblecycles.co.uk%2Fmedia%2Fcatalog%2Fproduct%2Fg%2Fr%2Fgravel_sl_pro_side_on_1.png&feedId=5923&k=e95d5f74de7f7cd40341c4b21eed3f507af75e71,,40.00,GBP4299.00,,,,,,
https://www.awin1.com/pclick.php?p=29805729023&a=87679&m=5923,"Ribble Gravel AL e - Enthusiast",29805729023,BBGRAVLE002,https://checkout.ribblecycles.co.uk/media/catalog/product/g/r/gravel_al_e_enthus_side_on.png,"GRAVEL     BUT FASTERPower your gravel adventures with a lightweight e-gravel bike that will have you blasting down trails faster and extending rides further than you ever thought possible. The Enthusiast edition features trail-capable components that have been selected for their ride enhancing capabilities and includes the slick shifts and gravel-optimised gearing of a Shimano GRX RX600 1x11 speed gear system, smooth-rolling LEVEL 650-e alloy wheels fitted with chunky WTB Sendero tyres and a gravel-specific finishing kit which includes gravel riser handlebars with flared drops for enhanced control and confidence on even the most extreme of off-road terrains.",Cycling,2999.00,"Ribble Cycles",5923,252,https://images2.productserve.com/?w=200&h=200&bg=white&trim=5&t=letterbox&url=ssl%3Acheckout.ribblecycles.co.uk%2Fmedia%2Fcatalog%2Fproduct%2Fg%2Fr%2Fgravel_al_e_enthus_side_on.png&feedId=5923&k=f4012f9403c5ca9794c3ea32380bcfd79bd1c710,,40.00,GBP2999.00,,,,,,
https://www.awin1.com/pclick.php?p=29805729027&a=87679&m=5923,"Ribble Gravel AL e - Hero",29805729027,BBGRAVLE004,https://checkout.ribblecycles.co.uk/media/catalog/product/g/r/gravel-al-e_herospec_side-on.png,"ULTIMATE E-GRAVEL      PERFORMANCEThe ultimate evolution of gravel riding, a lightweight alloy frameset matched with some of the lightest gravel-focused, cutting-edge tech available. We’ve adorned this range-topping model with the fully programmable and precision electronic shifts of Shimano’s GRX RX815 Di2 gear system, strong and durable LEVEL 650-e wheels fitted with chunky WTB Sendero and a gravel optimised finishing kit that includes LEVEL Gravel Riser alloy handlebars with flared drops for more stability and control when descending or navigating technical terrain. A true e-gravel powerhouse.",Cycling,4299.00,"Ribble Cycles",5923,252,https://images2.productserve.com/?w=200&h=200&bg=white&trim=5&t=letterbox&url=ssl%3Acheckout.ribblecycles.co.uk%2Fmedia%2Fcatalog%2Fproduct%2Fg%2Fr%2Fgravel-al-e_herospec_side-on.png&feedId=5923&k=d611aa6bcc9cd37671ae4b2b63cb93c1602e7f38,,40.00,GBP4299.00,,,,,,
https://www.awin1.com/pclick.php?p=22601192051&a=87679&m=5923,"Ribble Endurance AL Disc - Sport",22601192051,BBROADDA001,https://checkout.ribblecycles.co.uk/media/catalog/product/e/n/enduranceal_anthracite_tiagra_side-on.png,"PRACTICAL PERFORMANCE    Light, agile, and comfortable, the Endurance AL Disc is an aluminium endurance road bike that lends itself superbly to fast-paced rides short or long. It comes equipped for everyday rides with the reliable and capable gear shifting of Shimano's Tiagra 2x10 speed series drivetrain complete with an FSA Omega chainset, the all-weather braking performance of mechanical disc brakes and a dependable wheel combination for year-round road rides in Mavic Aksium wheels fitted with Continental Ultra Sport tyres. 		    	        Material	        6061-T6 Aluminium	    	    	        Brakes	        Disc.	    								Tyre Clearance				Up to 32mm								Weight				9.7kg/21.34lbs",Cycling,1099.00,"Ribble Cycles",5923,252,https://images2.productserve.com/?w=200&h=200&bg=white&trim=5&t=letterbox&url=ssl%3Acheckout.ribblecycles.co.uk%2Fmedia%2Fcatalog%2Fproduct%2Fe%2Fn%2Fenduranceal_anthracite_tiagra_side-on.png&feedId=5923&k=6de2fd198cbb651fe6f7b17d01dfdf55d8074eb2,,40.00,GBP1099.00,,,,,,
https://www.awin1.com/pclick.php?p=22601192059&a=87679&m=5923,"Ribble Endurance 725 - Base",22601192059,BB725CRC001,https://checkout.ribblecycles.co.uk/media/catalog/product/e/n/endurance-725-tiagra-web.png,"PERFECT COMBO OF    Tiagra &amp;amp; STEELA simply beautiful bike and perfect for commuters and leisure cyclists alike. The natural vibration absorption properties offered by the Reynolds steel tubing combined with Shimanos Tiagra 10 speed groupset offers a perfect mix of comfort and reliability.",Cycling,1299.00,"Ribble Cycles",5923,252,https://images2.productserve.com/?w=200&h=200&bg=white&trim=5&t=letterbox&url=ssl%3Acheckout.ribblecycles.co.uk%2Fmedia%2Fcatalog%2Fproduct%2Fe%2Fn%2Fendurance-725-tiagra-web.png&feedId=5923&k=7a5213c0148412c6ade6d98e8940f4230fe103d9,,40.00,GBP1299.00,,,,,,
https://www.awin1.com/pclick.php?p=22603142215&a=87679&m=5923,"Ribble Endurance 725 Disc - Base",22603142215,BB725CRG001,https://checkout.ribblecycles.co.uk/media/catalog/product/7/2/725_steel_greenyellow_tiagradisc_levelbar_wtbwheels___side.png,"FEEL THE     DIFFERENCEThe Endurance 725 evokes the spirit of cycling’s past with its handcrafted Reynolds steel frameset and vintage styling, but make no mistake this is a distinctly modern road bike. This edition takes advantage of the smooth and hassle-free shifts of Shimano’s Tiagra 2x10 speed gear system for all-day riding dependability and performance. This is further exemplified by the selection of Mavic’s ever-reliable Aksium wheelset, fitted with Continental tyres.",Cycling,1499.00,"Ribble Cycles",5923,252,https://images2.productserve.com/?w=200&h=200&bg=white&trim=5&t=letterbox&url=ssl%3Acheckout.ribblecycles.co.uk%2Fmedia%2Fcatalog%2Fproduct%2F7%2F2%2F725_steel_greenyellow_tiagradisc_levelbar_wtbwheels___side.png&feedId=5923&k=86edc39c370854467f8918f46e741b6bf855ca78,,40.00,GBP1499.00,,,,,,
https://www.awin1.com/pclick.php?p=23672125883&a=87679&m=5923,"Ribble Hybrid AL",23672125883,BBURBAAA011,https://checkout.ribblecycles.co.uk/media/catalog/product/h/y/hybrid-leisure-fully-loaded.png,"PERFECT FOR    COMMUTINGThe Hybrid Leisure is a superb all-rounder, a combination of an MTB and a road bike it offers incredible versatility. With flat handlebars, reliable gears and disc brakes you have a bike that is comfortable, reliable and above all fun to ride. Should you wish to carry luggage then the fully loaded option is a great choice as it comes fitted with a colour matched pannier rack and all of the accessories that you need to keep you safe and comfortable on your everyday adventures.",Cycling,1199.00,"Ribble Cycles",5923,252,https://images2.productserve.com/?w=200&h=200&bg=white&trim=5&t=letterbox&url=ssl%3Acheckout.ribblecycles.co.uk%2Fmedia%2Fcatalog%2Fproduct%2Fh%2Fy%2Fhybrid-leisure-fully-loaded.png&feedId=5923&k=7ad01a9deb765f0227d13ec0046761c7357f92b8,,40.00,GBP1199.00,,,,,,
https://www.awin1.com/pclick.php?p=29805728975&a=87679&m=5923,"Ribble Hybrid AL",29805728975,BBURBAAA021,https://checkout.ribblecycles.co.uk/media/catalog/product/h/y/hybrid-leisure_1_.png,"PERFECT FOR    COMMUTINGThe Hybrid Leisure is a superb all-rounder, a combination of a MTB and a road bike it offers superb versatility. With flat handlebars, reliable gears and disc brakes you have a bike that is comfortable, reliable and above all fun to ride.",Cycling,1099.00,"Ribble Cycles",5923,252,https://images2.productserve.com/?w=200&h=200&bg=white&trim=5&t=letterbox&url=ssl%3Acheckout.ribblecycles.co.uk%2Fmedia%2Fcatalog%2Fproduct%2Fh%2Fy%2Fhybrid-leisure_1_.png&feedId=5923&k=687b2716ebb93940a0e775b6a08c608dbea9ebb4,,40.00,GBP1099.00,,,,,,
https://www.awin1.com/pclick.php?p=29805728999&a=87679&m=5923,"Ribble Gravel AL - Enthusiast",29805728999,BBGRAVAL002,https://checkout.ribblecycles.co.uk/media/catalog/product/g/r/gravel_al_enthusiast_side_on.png,"GRAVEL      EVOLVEDThe Gravel AL explodes into life where the road ends and the off-road adventure begins and this Enthusiast edition hits the sweet spot between speed, simplicity and performance to deliver a ride that’s composed and maximise rider enjoyment. We have carefully selected the smooth-shifting precision and gravel-specific ergonomics of a Shimano GRX600 1x11 gear system with sturdy and smooth-rolling Mavic Allroad 650b tubeless-ready wheels fitted with the traction enabling Halo GXC Gravel 650bx47mm tyres and a gravel-specific finishing kit for complete comfort and control on the most extreme terrain.",Cycling,1999.00,"Ribble Cycles",5923,252,https://images2.productserve.com/?w=200&h=200&bg=white&trim=5&t=letterbox&url=ssl%3Acheckout.ribblecycles.co.uk%2Fmedia%2Fcatalog%2Fproduct%2Fg%2Fr%2Fgravel_al_enthusiast_side_on.png&feedId=5923&k=2af92f8f3efda07593b489f9b0892c1a5dd92699,,40.00,GBP1999.00,,,,,,
https://www.awin1.com/pclick.php?p=30609405863&a=87679&m=5923,"Ribble CGR AL - Gravel",30609405863,BBCGRABL150,https://checkout.ribblecycles.co.uk/media/catalog/product/c/g/cgr_al_blue_rival_side_on.png,"ALL-ROAD    PERFORMANCE &amp;amp; VERSATILITY Inject some adrenaline into your daily ride routine with the all-terrain capable CGR AL. This incredibly versatile all-road optimised specification includes the single ring simplicity and off-road gearing of SRAM's Rival 1x11 speed drivetrain, ruggedly reliable Mavic Aksium wheels fitted with grippy WTB Riddler tyres and a lightweight alloy finishing kit that includes handlebars with flared drops for confident and controlled steering, even on the roughest terrain.",Cycling,1899.00,"Ribble Cycles",5923,252,https://images2.productserve.com/?w=200&h=200&bg=white&trim=5&t=letterbox&url=ssl%3Acheckout.ribblecycles.co.uk%2Fmedia%2Fcatalog%2Fproduct%2Fc%2Fg%2Fcgr_al_blue_rival_side_on.png&feedId=5923&k=b2570ea568a6e9e1fea774d17fe7330aa64718af,,40.00,GBP1899.00,,,,,,
https://www.awin1.com/pclick.php?p=30553800123&a=87679&m=5923,"Ribble CGR AL Orange - Gravel",30553800123,BBCGRAOR150,https://checkout.ribblecycles.co.uk/media/catalog/product/c/g/cgr_al_orange_rival_side_on.png,"ALL-ROAD    PERFORMANCE &amp;amp; VERSATILITY Inject some adrenaline into your daily ride routine with the all-terrain capable CGR AL. This incredibly versatile all-terrain specification includes the single ring simplicity and off-road optimised gearing of SRAM's Rival 1x11 speed drivetrain, ruggedly durable Mavic Aksium wheels fitted with the surefooted traction of WTB Riddler tyres and a lightweight alloy finishing kit that includes handlebars with flared drops for improved stability and confident control, even on the roughest terrain.",Cycling,1899.00,"Ribble Cycles",5923,252,https://images2.productserve.com/?w=200&h=200&bg=white&trim=5&t=letterbox&url=ssl%3Acheckout.ribblecycles.co.uk%2Fmedia%2Fcatalog%2Fproduct%2Fc%2Fg%2Fcgr_al_orange_rival_side_on.png&feedId=5923&k=e9f6e443c05c8e8c62bb4fa6aabb528c8894a52f,,40.00,GBP1899.00,,,,,,
https://www.awin1.com/pclick.php?p=30614879399&a=87679&m=5923,"Ribble CGR 725 - Gravel",30614879399,BBCGR725027,https://checkout.ribblecycles.co.uk/media/catalog/product/c/g/cgr_725_rival_side_on.png,"CLASSIC LINES     MODERN PERFORMANCEWe have carefully created a bike for the rider who is looking for a bike that is different and modern, yet offers the comfortably compliant ride quality that is synonymous with traditional steel construction. This incredibly versatile all-road optimised specification includes the single ring simplicity and off-road gearing of SRAM's Rival 1x11 speed drivetrain, ruggedly reliable Mavic Aksium wheels fitted with grippy WTB Riddler tyres and the gravel-inspired ergonomics of LEVEL's gravel handlebars, complete with flared drops for improved stability and control, even on the roughest terrain. The CGR 725 takes you beyond road, with everything you need to tackle roads, gravel, or trail.",Cycling,2099.00,"Ribble Cycles",5923,252,https://images2.productserve.com/?w=200&h=200&bg=white&trim=5&t=letterbox&url=ssl%3Acheckout.ribblecycles.co.uk%2Fmedia%2Fcatalog%2Fproduct%2Fc%2Fg%2Fcgr_725_rival_side_on.png&feedId=5923&k=d0fadb5db9d95b45bcd6e96c47d98519e2d68b31,,40.00,GBP2099.00,,,,,,
https://www.awin1.com/pclick.php?p=30898357965&a=87679&m=5923,"Ribble Gravel AL - Enthusiast",30898357965,BBGRAVAL007,https://checkout.ribblecycles.co.uk/media/catalog/product/g/r/gravel_al_rival_side_on.png,"GRAVEL     WITH ATTITUDEDesigned to take on the toughest of terrains, the Gravel AL delivers a ride that is fast, light, and highly agile. Take your adrenaline-fueled exploits to new heights with a gravel-optimised spec that includes the single ring simplicity and off-road gearing of SRAM's Rival 1x11 speed drivetrain, strong and durable Mavic Allroad Alloy 650b wheels fitted with the surefooted traction of grippy Halo GXC Gravel 47mm tyres and the gravel-inspired ergonomics of LEVEL's gravel riser handlebars which include a flared drop section for enhanced stability and control when blasting along flowy singletrack or navigating techy descents.",Cycling,1999.00,"Ribble Cycles",5923,252,https://images2.productserve.com/?w=200&h=200&bg=white&trim=5&t=letterbox&url=ssl%3Acheckout.ribblecycles.co.uk%2Fmedia%2Fcatalog%2Fproduct%2Fg%2Fr%2Fgravel_al_rival_side_on.png&feedId=5923&k=15497b54a639fa20bdb60ccf21ecddda51bb7e24,,40.00,GBP1999.00,,,,,,
https://www.awin1.com/pclick.php?p=22603142125&a=87679&m=5923,"Ribble CX AL",22603142125,BBCXDARD001,https://checkout.ribblecycles.co.uk/media/catalog/product/c/x/cx_red_apex_disc__side-web.png,"PERFECT COMBO OF      SRAM Apex 1x &amp;amp; ALUMINIUMSRAMs 1x groupsets are a great choice for cyclocross bikes due to their inherent simplicity. The lack of a front derailleur eliminates the chances of front shift failures when clogged up with mud. With SRAMs unique 'double tap' system where one small push of the lever blade shifts up the cassette and a longer press shifts down Sram states that 'this offers intuitive one handed shifting&amp;rsquo;.",Cycling,1399.00,"Ribble Cycles",5923,252,https://images2.productserve.com/?w=200&h=200&bg=white&trim=5&t=letterbox&url=ssl%3Acheckout.ribblecycles.co.uk%2Fmedia%2Fcatalog%2Fproduct%2Fc%2Fx%2Fcx_red_apex_disc__side-web.png&feedId=5923&k=1b7cc169469eb3f79405e5f0964007242185f2be,,40.00,GBP1399.00,,,,,,
https://www.awin1.com/pclick.php?p=31409221119&a=87679&m=5923,"Ribble Urban 725s",31409221119,BBURBEX1000,https://checkout.ribblecycles.co.uk/media/catalog/product/u/r/urban_single_speed_725__side_on.png,"The Fixie/Singlespeed is a familiar sight on city streets across the world. Popular with couriers and commuters alike who love their urban cool, speed and simplicity, the Fixie gets you from A to B quickly, in style and thanks to their simple design with very low maintenance.",Cycling,599.00,"Ribble Cycles",5923,252,https://images2.productserve.com/?w=200&h=200&bg=white&trim=5&t=letterbox&url=ssl%3Acheckout.ribblecycles.co.uk%2Fmedia%2Fcatalog%2Fproduct%2Fu%2Fr%2Furban_single_speed_725__side_on.png&feedId=5923&k=60f38ee1beb022fe55defeb70ee12957f330c989,,40.00,GBP599.00,,,,,,
https://www.awin1.com/pclick.php?p=25516670161&a=87679&m=5923,"Ribble HT 725 - Enthusiast",25516670161,BBMTB725002,https://checkout.ribblecycles.co.uk/media/catalog/product/h/t/ht_725_frnt_angled_1.png,"MODERN REYNOLDS STEEL HARDTAIL     The HT 725 with SRAM’s NX Eagle offers incredible performance, durability and the compliance provided by a modern Reynolds steel frame. With an off-road optimised gear range that is the equal of any double ring set up and intuitive, easy to use shifts, the Eagle series is the lightest and most advanced drivetrain available today. Matched to Rockshox Gold RL 150mm forks, Level 35 wheels, a complete Level finishing kit consisting of Level bars, stem, a 150mm dropper post, and a WTB saddle.",Cycling,1899.00,"Ribble Cycles",5923,252,https://images2.productserve.com/?w=200&h=200&bg=white&trim=5&t=letterbox&url=ssl%3Acheckout.ribblecycles.co.uk%2Fmedia%2Fcatalog%2Fproduct%2Fh%2Ft%2Fht_725_frnt_angled_1.png&feedId=5923&k=eff8b398853d198db99063ecdb86d051d5de83b0,,40.00,GBP1899.00,,,,,,
https://www.awin1.com/pclick.php?p=29805728875&a=87679&m=5923,"Ribble CGR AL - Flat Bar",29805728875,BBCGRABL130,https://checkout.ribblecycles.co.uk/media/catalog/product/c/g/cgr_al_blue_flatbar_apex___side_on.png,"ALL-ROAD    COMFORT &amp; VERSATILITY Created for those who prefer the added confidence and comfort of an MTB  style riding position, the CGR AL flat bar offers enhanced stability and control over a range of terrains and surfaces. The single ring simplicity of SRAM's Apex 1 gear system delivers an easy-to-use and intuitive shifting experience that can be relied upon, no matter where you choose to ride. Ever-reliable Mavic Aksium wheels fitted with fast and grippy Schwalbe G-One Allround tyres are the ideal option for year-round riding on varied terrain.",Cycling,1399.00,"Ribble Cycles",5923,252,https://images2.productserve.com/?w=200&h=200&bg=white&trim=5&t=letterbox&url=ssl%3Acheckout.ribblecycles.co.uk%2Fmedia%2Fcatalog%2Fproduct%2Fc%2Fg%2Fcgr_al_blue_flatbar_apex___side_on.png&feedId=5923&k=9713dfb7bae66b44cc522b3ca82e1d3ebc220739,,40.00,GBP1399.00,,,,,,
https://www.awin1.com/pclick.php?p=29805728877&a=87679&m=5923,"Ribble CGR AL - Flat Bar",29805728877,BBCGRAOR130,https://checkout.ribblecycles.co.uk/media/catalog/product/c/g/cgr_al_orange_flatbar_apex_side_on_brighter_1.png,"ALL-ROAD    ADVENTURE Created for those who prefer the added confidence and comfort of an MTB style riding position, the CGR AL Flat Bar offers enhanced stability and control over a range of surfaces. The single-ring simplicity of SRAM's  Apex 1x gear system delivers an easy-to-use and intuitive shifting experience that can be relied on, no matter where you ride. Ever-reliable Mavic Aksium wheels fitted with Schwalbe G-One tyres are a rugged and dependable choice for all-season riding.",Cycling,1399.00,"Ribble Cycles",5923,252,https://images2.productserve.com/?w=200&h=200&bg=white&trim=5&t=letterbox&url=ssl%3Acheckout.ribblecycles.co.uk%2Fmedia%2Fcatalog%2Fproduct%2Fc%2Fg%2Fcgr_al_orange_flatbar_apex_side_on_brighter_1.png&feedId=5923&k=87568a60a1ac2fd83e3abd9a0a8fcfe2007ae6a8,,40.00,GBP1399.00,,,,,,
https://www.awin1.com/pclick.php?p=29805729021&a=87679&m=5923,"Ribble Gravel AL e - Sport",29805729021,BBGRAVLE001,https://checkout.ribblecycles.co.uk/media/catalog/product/g/r/gravel_al_e_sport_side_on.png,"GRAVEL     BUT FASTERPower your gravel adventures on an e-gravel machine that sets the benchmark for lightweight, power-assisted, all-terrain performance. For the Sport edition, we've selected the gravel-specific ergonomics and off-road optimised gear ratios of Shimano’s GRX400 2x10 speed gear system, a dependable LEVEL 650-e alloy wheelset fitted with chunky WTB Sendero tyres and a gravel-focused finishing kit that includes flared gravel bars for more confidence and control on the rough stuff.",Cycling,2699.00,"Ribble Cycles",5923,252,https://images2.productserve.com/?w=200&h=200&bg=white&trim=5&t=letterbox&url=ssl%3Acheckout.ribblecycles.co.uk%2Fmedia%2Fcatalog%2Fproduct%2Fg%2Fr%2Fgravel_al_e_sport_side_on.png&feedId=5923&k=0aa7852dee338e089f1df930246416d11cdcdfcf,,40.00,GBP2699.00,,,,,,
https://www.awin1.com/pclick.php?p=29805729031&a=87679&m=5923,"Ribble HT AL - Sport",29805729031,BBMTBAL7001,https://checkout.ribblecycles.co.uk/media/catalog/product/h/t/ht_al_650b_sportspec_side_on.png,"LOSE YOUR    LIMITSThe HT AL is an aluminium hardcore hardtail that pushes you to the limit and shifts your mindset from what you thought was possible on a hardtail. It comes fully kitted out with the single-ring simplicity and lightning-fast shifts of a SRAM SX Eagle drivetrain, with ruggedly reliable Rockshox Recon RL forks to absorb the hits. Smooth-rolling LEVEL 35 wheels fitted with iconic Maxxis Minion tyres and a trail-capable finishing kit all add up to a modern hardcore hardtail that you can enjoy riding anywhere.",Cycling,1399.00,"Ribble Cycles",5923,252,https://images2.productserve.com/?w=200&h=200&bg=white&trim=5&t=letterbox&url=ssl%3Acheckout.ribblecycles.co.uk%2Fmedia%2Fcatalog%2Fproduct%2Fh%2Ft%2Fht_al_650b_sportspec_side_on.png&feedId=5923&k=29de54d2bb142b58d2896d6fe7a2a56739f474d2,,40.00,GBP1399.00,,,,,,
