aw_deep_link,product_name,aw_product_id,merchant_product_id,merchant_image_url,description,merchant_category,search_price,merchant_name,merchant_id,category_id,aw_image_url,store_price,delivery_cost,display_price,ean,isbn,upc,mpn,parent_product_id,product_GTIN
https://www.awin1.com/pclick.php?p=22601192117&a=87679&m=5923,"Ribble Endurance AL Disc - Enthusiast",22601192117,BBROADDA002,https://checkout.ribblecycles.co.uk/media/catalog/product/e/n/endurance-al-disc_antracite_105_side-on_1_1.png,"SMOOTH, PRECISE    &amp; CONTROLLEDThe Endurance AL Disc is an aluminium endurance road bike that is designed to offer an exhilarating mixture of speed and efficiency for those long days in the saddle. With its mile-eating comfort and race-like performance, the Endurance AL is the perfect choice for the amateur racer, everyday commuter, and weekend hero. For the Enthusiast Edition, we have selected a Shimano 105 groupset for its slick and precise shifting performance and the all-condition stopping power of hydraulic disc brakes. Mavic Aksium wheels fitted with Continental Ultra Sport tyres are a strong and dependable combination for year-round road riding.",Cycling,1299.00,"Ribble Cycles",5923,252,https://images2.productserve.com/?w=200&h=200&bg=white&trim=5&t=letterbox&url=ssl%3Acheckout.ribblecycles.co.uk%2Fmedia%2Fcatalog%2Fproduct%2Fe%2Fn%2Fendurance-al-disc_antracite_105_side-on_1_1.png&feedId=5923&k=534acf4cf09b4c45b22bb58aab1e06fb43788419,,40.00,GBP1299.00,,,,,,
https://www.awin1.com/pclick.php?p=22603142133&a=87679&m=5923,"Ribble Endurance 725 Disc - Base",22603142133,BB725CRD001,https://checkout.ribblecycles.co.uk/media/catalog/product/7/2/725_steel_blkwhite_tiagra_disc_levelbars___side.png,"FEEL THE   DIFFERENCEThe Endurance 725 evokes the spirit of cycling’s past with its handcrafted Reynolds steel frameset and vintage styling, but make no mistake this is a distinctly modern road bike. This build package takes advantage of the smooth and hassle-free shifts of Shimano’s Tiagra 2x10 speed gear system for all-day riding dependability and performance. This is further exemplified by the selection of Mavic’s ever-reliable Aksium wheelset fitted with Continental tyres.",Cycling,1499.00,"Ribble Cycles",5923,252,https://images2.productserve.com/?w=200&h=200&bg=white&trim=5&t=letterbox&url=ssl%3Acheckout.ribblecycles.co.uk%2Fmedia%2Fcatalog%2Fproduct%2F7%2F2%2F725_steel_blkwhite_tiagra_disc_levelbars___side.png&feedId=5923&k=1b3240053a9c34bf8c5a599593e5a1e3ee18b386,,40.00,GBP1499.00,,,,,,
https://www.awin1.com/pclick.php?p=22665175191&a=87679&m=5923,"Ribble Ultra TT Front Brake Cover - Non UCI",22665175191,RIBBFRAZ510,https://checkout.ribblecycles.co.uk/media/catalog/product/i/m/img_3115_1.jpg,"Ultra TT Front Brake Cover (Non UCI)The hallmark of any time trial machine is its clean aesthetics and streamlined form which create a lower drag coefficient. Designed exclusively to fit the Ultra platform the cover offers seamless integration with the TRP T860/T861 Aero brakes. This non-UCI legal front brake cover delivers a completely integrated front end with airflow diverted smoothly around cables and components for the superior aerodynamics that only a world-class superbike offers. This is why the Ultra TT is a record-breaking, national title-winning, time trial superbike with a proven record at domestic level and on the world stage.Available in a range of sizes, choose the correct one to match your frame size.Does not comply with UCI regulations. A UCI legal cover is available here.",Cycling,125.00,"Ribble Cycles",5923,252,https://images2.productserve.com/?w=200&h=200&bg=white&trim=5&t=letterbox&url=ssl%3Acheckout.ribblecycles.co.uk%2Fmedia%2Fcatalog%2Fproduct%2Fi%2Fm%2Fimg_3115_1.jpg&feedId=5923&k=4a7a01d481117b53350b8ca1c8128552786ad695,,3.00,GBP125.00,,,,,,
https://www.awin1.com/pclick.php?p=23642448907&a=87679&m=5923,"Ribble Hybrid AL e",23642448907,BBURBANE001,https://checkout.ribblecycles.co.uk/media/catalog/product/h/y/hybrid_al_e_teal_fully_loaded_45_side_on_1.png,,Cycling,2299.00,"Ribble Cycles",5923,252,https://images2.productserve.com/?w=200&h=200&bg=white&trim=5&t=letterbox&url=ssl%3Acheckout.ribblecycles.co.uk%2Fmedia%2Fcatalog%2Fproduct%2Fh%2Fy%2Fhybrid_al_e_teal_fully_loaded_45_side_on_1.png&feedId=5923&k=b9a36a6cfd0396b31491901679ae6d927e2f3499,,40.00,GBP2299.00,,,,,,
https://www.awin1.com/pclick.php?p=24936270465&a=87679&m=5923,"Ribble Hybrid AL e",24936270465,BBURBANE006,https://checkout.ribblecycles.co.uk/media/catalog/product/h/y/hybrid_al_e_copper_fully_loaded_side_on_1.png,"WHATEVER YOU    NEED IT TO BEThe perfect blend of style, comfort and efficiency the Hybrid AL e combines features and technology with classic British styling.At home in the city and on the trails this cycle scheme approved bike is the choice for those who want to enjoy riding without being limited by terrain or distance.",Cycling,2299.00,"Ribble Cycles",5923,252,https://images2.productserve.com/?w=200&h=200&bg=white&trim=5&t=letterbox&url=ssl%3Acheckout.ribblecycles.co.uk%2Fmedia%2Fcatalog%2Fproduct%2Fh%2Fy%2Fhybrid_al_e_copper_fully_loaded_side_on_1.png&feedId=5923&k=31dec9be7bf6c763b1c739a9f8a05b64a8f62b5b,,40.00,GBP2299.00,,,,,,
https://www.awin1.com/pclick.php?p=24863432087&a=87679&m=5923,"Ribble HT 725 - Sport",24863432087,BBMTB725001,https://checkout.ribblecycles.co.uk/media/catalog/product/h/t/ht_725_sx_frontangle_1.png,"MODERN REYNOLDS STEEL HARDTAIL     The HT 725 SX Eagle is an incredibly durable platform for carving up the trails. The SRAM SX Eagle groupset features the simplicity of the single chainring configuration and a seriously low gear range optimised for even the steepest of climbs. Rockshox Recon RL forks with 32mm stanchions and SoloAir springs provide a plush and predictable ride. With Level 35 alloy wheels and a complete Level alloy finishing kit this bike is a real trail-taming rig",Cycling,1599.00,"Ribble Cycles",5923,252,https://images2.productserve.com/?w=200&h=200&bg=white&trim=5&t=letterbox&url=ssl%3Acheckout.ribblecycles.co.uk%2Fmedia%2Fcatalog%2Fproduct%2Fh%2Ft%2Fht_725_sx_frontangle_1.png&feedId=5923&k=7d5e64240caf5532038d086068554c52e0a75e7e,,40.00,GBP1599.00,,,,,,
https://www.awin1.com/pclick.php?p=25516670163&a=87679&m=5923,"Ribble HT 725 - Pro",25516670163,BBMTB725003,https://checkout.ribblecycles.co.uk/media/catalog/product/h/t/ht_725_gx_wtb_saddle_front_angled.png,"MODERN REYNOLDS STEEL HARDTAIL     Providing trail-shredding performance and durability, SRAM’s lightweight and smooth-shifting GX Eagle combines with the incredible compliance of a modern Reynolds steel frame to produce an epic ride for serious-minded singletrack slayers. This top-spec also benefits from the trail-smoothing performance of RockShox Revelation RC BOOST 150mm forks, Level 35 Disc wheels, and a high-end Level finishing kit consisting of lightweight XV 7075 alloy bars, XV 6061 CNC'd stem, and Level 150mm dropper post. A WTB Koda SL8 completes the build package with a lightweight, race profile.",Cycling,2199.00,"Ribble Cycles",5923,252,https://images2.productserve.com/?w=200&h=200&bg=white&trim=5&t=letterbox&url=ssl%3Acheckout.ribblecycles.co.uk%2Fmedia%2Fcatalog%2Fproduct%2Fh%2Ft%2Fht_725_gx_wtb_saddle_front_angled.png&feedId=5923&k=57abc601c9baea51b0c1262d644c0970c5e265b9,,40.00,GBP2199.00,,,,,,
https://www.awin1.com/pclick.php?p=25633950669&a=87679&m=5923,"Ribble CGR AL - Enthusiast",25633950669,BBCGRABL110,https://checkout.ribblecycles.co.uk/media/catalog/product/c/g/cgr_al_105_blue_side_view.png,"ALL-TERRAIN PERFORMANCE     &amp; VERSATILITY Shimano’s 105 groupset is the entry point into 11-speed shifting and has established itself as the benchmark for shifting efficiency and performance.This is in no small part thanks to the exceptionally smooth, precision shifting performance and incredible value. The addition of Mavic’s ever-reliable Aksium wheelset complete with a great all-rounder in the form of Schwalbe's G-One tyres ensures maximum reliability, durability and traction across a range of surfaces. With a generous tyre clearance plus mudguard and rack compatibility, the CGR AL is perfect loaded or light and designed to excel whether the ride is on road, off-road or a mixture of both.",Cycling,1799.00,"Ribble Cycles",5923,252,https://images2.productserve.com/?w=200&h=200&bg=white&trim=5&t=letterbox&url=ssl%3Acheckout.ribblecycles.co.uk%2Fmedia%2Fcatalog%2Fproduct%2Fc%2Fg%2Fcgr_al_105_blue_side_view.png&feedId=5923&k=34dd3e2e54a6cd5f9d3bac669608366ac3e50af8,,40.00,GBP1799.00,,,,,,
https://www.awin1.com/pclick.php?p=25659315159&a=87679&m=5923,"Ribble Endurance SL e - Enthusiast",25659315159,BBENDCAN002,https://checkout.ribblecycles.co.uk/media/catalog/product/e/n/endurance_sle_105_grey_side_on.png,"MAKE IT POSSIBLE     The ultimate stealth e-road bike with discreet hub-driven power assistance and market-leading weight. Shimano’s 105 R7000 series 2x11 speed groupset provides assured, precision shifting and confidence-inspiring braking courtesy of the powerful hydraulic disc brakes. A tubeless-ready Mavic Ksyrium S Disc wheelset provides exceptional reliability and durability. The LEVEL 5 integrated carbon handlebar and stem system provide a super-clean, cable-free, front end with improved aerodynamics.",Cycling,3299.00,"Ribble Cycles",5923,252,https://images2.productserve.com/?w=200&h=200&bg=white&trim=5&t=letterbox&url=ssl%3Acheckout.ribblecycles.co.uk%2Fmedia%2Fcatalog%2Fproduct%2Fe%2Fn%2Fendurance_sle_105_grey_side_on.png&feedId=5923&k=bfadd2638370f19055c81be5f4904293577266e7,,40.00,GBP3299.00,,,,,,
https://www.awin1.com/pclick.php?p=25673672333&a=87679&m=5923,"Ribble CGR AL - Pro",25673672333,BBCGRABL120,https://checkout.ribblecycles.co.uk/media/catalog/product/c/g/cgr_al_blue_ultegra__side_on.png,"ALL-TERRAIN PERFORMANCE    &amp; VERSATILITY Shimano Ultegra has long been the choice of amateur racers and cycle enthusiasts who value its weight-saving features, advanced materials, and precision shifting performance. Further performance upgrades include the improved comfort and aerodynamics of Level 2 alloy handlebars and a lightweight Level 2 carbon seatpost which helps to absorb vibration. Mavic Allroad UST are a lightweight, tubeless-ready wheelset and when paired with Schwalbe G-One tyres are the perfect combination of rugged durability and grip.",Cycling,2199.00,"Ribble Cycles",5923,252,https://images2.productserve.com/?w=200&h=200&bg=white&trim=5&t=letterbox&url=ssl%3Acheckout.ribblecycles.co.uk%2Fmedia%2Fcatalog%2Fproduct%2Fc%2Fg%2Fcgr_al_blue_ultegra__side_on.png&feedId=5923&k=4adfeabeb3815083d737a3e1b4106b4a9b0e064b,,40.00,GBP2199.00,,,,,,
https://www.awin1.com/pclick.php?p=25768009757&a=87679&m=5923,"Ribble CGR AL - Sport",25768009757,BBCGRABL100,https://checkout.ribblecycles.co.uk/media/catalog/product/c/g/cgr_al_tiagra_blue_side_on.png,"ALL-TERRAIN PERFORMANCE    &amp; VERSATILITY Shimano’s Tiagra 10 speed groupset, matched with Mavic Aksium wheels and Schwalbe Marathon tyres is a tried and tested combination that offers exceptional reliability and durability throughout the seasons. The superior modulation and braking performance of disc brakes provide added confidence and control over any terrain and in any conditions. With a generous tyre clearance and the additional versatility provided by mudguard and racks mounts the CGR AL excels as an all-season commuter, light tourer or gravel bike.",Cycling,1399.00,"Ribble Cycles",5923,252,https://images2.productserve.com/?w=200&h=200&bg=white&trim=5&t=letterbox&url=ssl%3Acheckout.ribblecycles.co.uk%2Fmedia%2Fcatalog%2Fproduct%2Fc%2Fg%2Fcgr_al_tiagra_blue_side_on.png&feedId=5923&k=be0ed560319f95c326fc65cd7fca9d7abbaa3440,,40.00,GBP1399.00,,,,,,
https://www.awin1.com/pclick.php?p=25768009759&a=87679&m=5923,"Ribble CGR AL - Sport",25768009759,BBCGRAOR100,https://checkout.ribblecycles.co.uk/media/catalog/product/c/g/cgr_al_tiagra_side_on.png,"RUGGEDLY VERSATILE    MULTI-TERRAIN EXPLORER Shimano’s Tiagra 10 speed groupset, matched with Mavic Aksium wheels and Schwalbe Marathon tyres is a tried and tested formula for exceptional reliability and durability throughout the seasons. The superior modulation and braking power of disc brakes provide added braking confidence over any terrain and in any conditions. With a generous tyre clearance and the added versatility of mudguard and rack mounts the CGR AL excels as an all-season commuter, light tourer or gravel bike.",Cycling,1399.00,"Ribble Cycles",5923,252,https://images2.productserve.com/?w=200&h=200&bg=white&trim=5&t=letterbox&url=ssl%3Acheckout.ribblecycles.co.uk%2Fmedia%2Fcatalog%2Fproduct%2Fc%2Fg%2Fcgr_al_tiagra_side_on.png&feedId=5923&k=f3540d83a6c577df813aed8b288652088616bba5,,40.00,GBP1399.00,,,,,,
https://www.awin1.com/pclick.php?p=25857344549&a=87679&m=5923,"Ribble CGR AL - Enthusiast",25857344549,BBCGRAOR110,https://checkout.ribblecycles.co.uk/media/catalog/product/c/g/cgr_al_105_orange_side_view.png,"ALL-TERRAIN PERFORMANCE    &amp; VERSATILITY Supremely versatile and highly capable across varied terrain, the CGR AL conquers all riding surfaces with ease. Built around a lightweight yet robust aluminium frame, Shimano's 105 series groupset has established itself as the benchmark for 11-speed gear shifting efficiency and will empower you to go after ever greater challenges,  Mavic’s ever-reliable Aksium wheels complete with a great all-rounder in the form of Schwalbe's G-One tyres ensure maximum reliability, durability and traction across a range of surfaces. With a generous tyre clearance and discreet mounts for mudguard and rack compatibility, the CGR AL is perfect loaded or light, and is designed to excel wherever the ride takes you.",Cycling,1799.00,"Ribble Cycles",5923,252,https://images2.productserve.com/?w=200&h=200&bg=white&trim=5&t=letterbox&url=ssl%3Acheckout.ribblecycles.co.uk%2Fmedia%2Fcatalog%2Fproduct%2Fc%2Fg%2Fcgr_al_105_orange_side_view.png&feedId=5923&k=0b0b0964bba6c7bb028485bef89954c11d5bfbe3,,40.00,GBP1799.00,,,,,,
https://www.awin1.com/pclick.php?p=26024490299&a=87679&m=5923,"Ribble Ultra TT Brake Cover Rear",26024490299,RIBBFRAZ515,https://checkout.ribblecycles.co.uk/media/catalog/product/i/m/img_3121.jpg,"Ultra TT Rear Brake CoverThe hallmark of an elite time trial machine is its clean aesthetics and streamlined form which create a lower drag coefficient. Designed to work with the Ultra platform this rear brake cover diverts airflow smoothly around cables and components for the superior aerodynamics that only a world-class superbike offers.3D printed for enhanced strength and durability.Compatible with Ultra TT/TTR &amp; Tri models.Available in a choice of sizes, choose the correct one to suit your frame size.",Cycling,125.00,"Ribble Cycles",5923,252,https://images2.productserve.com/?w=200&h=200&bg=white&trim=5&t=letterbox&url=ssl%3Acheckout.ribblecycles.co.uk%2Fmedia%2Fcatalog%2Fproduct%2Fi%2Fm%2Fimg_3121.jpg&feedId=5923&k=43050ed340fcfd1c7ef5f30e809847dd1733e740,,3.00,GBP125.00,,,,,,
https://www.awin1.com/pclick.php?p=26125017185&a=87679&m=5923,"Ribble CGR AL - Pro",26125017185,BBCGRAOR120,https://checkout.ribblecycles.co.uk/media/catalog/product/c/g/cgr_al_orange_ultegra_side_on_2.png,"ALL-TERRAIN PERFORMANCE    &amp; VERSATILITY Shimano Ultegra has long been the choice of amateur racers and cycle enthusiasts who value its weight-saving features, advanced materials, and precision shifting performance Further performance upgrades include the improved comfort and aerodynamics of Level 2 alloy handlebars and a lightweight Level 2 carbon seatpost. Mavic Allroad's are a lightweight, tubeless-ready wheelset and paired with Schwalbe G-One tyres are the perfect combination of rugged durability and grip for on and off-road adventures.",Cycling,2199.00,"Ribble Cycles",5923,252,https://images2.productserve.com/?w=200&h=200&bg=white&trim=5&t=letterbox&url=ssl%3Acheckout.ribblecycles.co.uk%2Fmedia%2Fcatalog%2Fproduct%2Fc%2Fg%2Fcgr_al_orange_ultegra_side_on_2.png&feedId=5923&k=add5cbed5fb288fa93aadda0817092f104469566,,40.00,GBP2199.00,,,,,,
https://www.awin1.com/pclick.php?p=26370919857&a=87679&m=5923,"Ribble CGR Ti - Sport",26370919857,BBCGTIV3001,https://checkout.ribblecycles.co.uk/media/catalog/product/c/g/cgr_ti_sport_build_side_on_v2.png,"THE PERFECT    ADVENTURERoad, gravel, or trail the CGR Ti certainly ticks all the boxes. This highly versatile machine is designed to do it all. The sport edition is equipped with the exceptionally smooth, precision shifting performance of Shimano’s 105 11-speed complete and powerful 105 hydraulic disc brakes. Mavic’s ever reliable Aksium wheelset with the all-terrain versatility of Schwalbe G-One Allround tyres are a highly capable wheelset for year-round riding.Additional versatility is provided by the inclusion of a set of fitted Ribble 46mm reinforced plastic mudguards for improved all-season wet weather protection and mounting points for a rear pannier rack, to take care of any luggage carrying needs.",Cycling,2499.00,"Ribble Cycles",5923,252,https://images2.productserve.com/?w=200&h=200&bg=white&trim=5&t=letterbox&url=ssl%3Acheckout.ribblecycles.co.uk%2Fmedia%2Fcatalog%2Fproduct%2Fc%2Fg%2Fcgr_ti_sport_build_side_on_v2.png&feedId=5923&k=4d77e009d4c2d999787faee95fc7407e1451eeaa,,40.00,GBP2499.00,,,,,,
https://www.awin1.com/pclick.php?p=26374791719&a=87679&m=5923,"Ribble CGR Ti - Enthusiast",26374791719,BBCGTIV3002,https://checkout.ribblecycles.co.uk/media/catalog/product/c/g/cgr_ti_enthus_side_view_v2.png,"THE PERFECT    ADVENTURERoad, gravel, or trail the CGR Ti certainly ticks all the boxes. This highly versatile machine is designed to do it all. The enthusiast features a Shimano Ultegra 11-speed groupset which has long been the choice of amateur racers and cycle enthusiasts who value its weight-saving features, advanced materials and precision shifting performance. A set of incredibly strong, light, and durable Mavic Allroad wheels matched with the all-terrain versatility of Schwalbe’s G-One Allround tyres provide a hugely capable wheelset for all-season riding.Additional versatility is provided by the addition of pannier rack mounts which takes care of luggage carrying needs and mudguard mounts for the fitting of full-coverage mudguards for all-season wet weather protection.",Cycling,2899.00,"Ribble Cycles",5923,252,https://images2.productserve.com/?w=200&h=200&bg=white&trim=5&t=letterbox&url=ssl%3Acheckout.ribblecycles.co.uk%2Fmedia%2Fcatalog%2Fproduct%2Fc%2Fg%2Fcgr_ti_enthus_side_view_v2.png&feedId=5923&k=23b2ca8d80ab60cf5fc733ae5f564bf1099484b7,,40.00,GBP2899.00,,,,,,
https://www.awin1.com/pclick.php?p=26374791721&a=87679&m=5923,"Ribble CGR Ti - Pro",26374791721,BBCGTIV3003,https://checkout.ribblecycles.co.uk/media/catalog/product/c/g/cgr_ti_pro_side_on.png,"THE PERFECT    ADVENTURERoad, gravel, or trail the CGR Ti certainly ticks all the boxes. This highly versatile speed machine is designed to do it all. The premium Pro Edition features Shimano’s latest iteration of the ever-popular Ultegra Di2 electronic groupset. Ultegra Di2 features refined ergonomics for improved all-day comfort and seamless fit and forget shifting. A set of incredibly strong and lightweight LEVEL 40 Carbon Comp wheels matched with the highly capable all-terrain versatility of Schwalbe’s G-One Allround tyres provide a highly capable wheelset for year-round riding. Additional versatility is provided by the addition of pannier rack mounts which takes care of luggage carrying needs and mudguard mounts for the fitting of full-coverage mudguards for all-season wet weather protection.",Cycling,4399.00,"Ribble Cycles",5923,252,https://images2.productserve.com/?w=200&h=200&bg=white&trim=5&t=letterbox&url=ssl%3Acheckout.ribblecycles.co.uk%2Fmedia%2Fcatalog%2Fproduct%2Fc%2Fg%2Fcgr_ti_pro_side_on.png&feedId=5923&k=1258e05826862920d7431939580091de5ad4af5d,,40.00,GBP4399.00,,,,,,
https://www.awin1.com/pclick.php?p=26485331537&a=87679&m=5923,"Ribble CGR Ti - Gravel",26485331537,BBCGTIV3004,https://checkout.ribblecycles.co.uk/media/catalog/product/c/g/cgr_ti_grx_sideon_.png,"FOR THE PERFECT    ADVENTUREThe CGR Ti is a highly versatile machine that is designed to do it all, a bike that excels when the ride heads off-road yet is fast enough to keep pace with the pack when dirt meets tarmac. This gravel grinding build is specifically equipped with high-quality components that boost its off-road credentials. Shimano’s GRX 1x drivetrain is the ideal choice to complement the premium ride feel of a Titanium frame, designed to cope with the unique demands of off-road riding GRX sets a new benchmark for all-terrain comfort, performance and versatility. No matter the surface, no matter the terrain a combination of Mavic’s Allroad SL tubeless-ready, gravel wheelset matched with WTB Byway tyres offers a plush ride feel and ample traction to help you stay more comfortable and in control.",Cycling,3299.00,"Ribble Cycles",5923,252,https://images2.productserve.com/?w=200&h=200&bg=white&trim=5&t=letterbox&url=ssl%3Acheckout.ribblecycles.co.uk%2Fmedia%2Fcatalog%2Fproduct%2Fc%2Fg%2Fcgr_ti_grx_sideon_.png&feedId=5923&k=ce1dc4161afc7f5bd8c2d4efb3c4df1dd69ee64a,,40.00,GBP3299.00,,,,,,
https://www.awin1.com/pclick.php?p=26927833233&a=87679&m=5923,"Ribble CGR 725 - Sport",26927833233,BBCGR725021,https://checkout.ribblecycles.co.uk/media/catalog/product/c/g/cgr725_sport_cut_side_on.png,"TRADITIONAL CLASS, VERSATILITY     &amp; PERFORMANCEThe CGR 725 is a hugely capable multi-terrain gravel bike. Designed around the elegant, ride smoothing, and infinitely rugged Reynolds 725 steel frameset is a package that offers incredible versatility. The Sport Edition features the smooth shifts and outstanding durability of Shimano’s Tiagra 10 speed groupset with the additional braking confidence of mechanical disc brakes and a set of Mavic Aksium wheels shod with Schwalbe Marathon tyres for impressive year-round traction and reliability across variable surfaces. With a generous tyre clearance, and the additional versatility of compatibility with mudguard and a rear pannier rack the CGR 725 excels as an all-terrain commuter, light tourer or gravel crusher.",Cycling,1599.00,"Ribble Cycles",5923,252,https://images2.productserve.com/?w=200&h=200&bg=white&trim=5&t=letterbox&url=ssl%3Acheckout.ribblecycles.co.uk%2Fmedia%2Fcatalog%2Fproduct%2Fc%2Fg%2Fcgr725_sport_cut_side_on.png&feedId=5923&k=3ba4302f6fedbf3f8e32e0d4f9daef5f801ffd4d,,40.00,GBP1599.00,,,,,,
https://www.awin1.com/pclick.php?p=27133908367&a=87679&m=5923,"Ribble CGR 725",27133908367,BBCGR725020,https://checkout.ribblecycles.co.uk/media/catalog/product/c/g/cgr_725_hero_side_on.png,"The CGR 725 is a striking blend of multi-terrain versatility with the traditional style and compliance of a Reynolds steel frame. Resulting in a steel bike that is highly capable across a multitude of terrains and surfaces, a true one bike to do it all.",Cycling,1599.00,"Ribble Cycles",5923,252,https://images2.productserve.com/?w=200&h=200&bg=white&trim=5&t=letterbox&url=ssl%3Acheckout.ribblecycles.co.uk%2Fmedia%2Fcatalog%2Fproduct%2Fc%2Fg%2Fcgr_725_hero_side_on.png&feedId=5923&k=5ed1a1cf97a495f78c35f7cd8804e926ee158cb1,,40.00,GBP1599.00,,,,,,
https://www.awin1.com/pclick.php?p=27133908369&a=87679&m=5923,"Ribble CGR 725 - Enthusiast",27133908369,BBCGR725022,https://checkout.ribblecycles.co.uk/media/catalog/product/c/g/cgr725_enthus_cut_side_on.png,"TRADITIONAL CLASS, VERSATILITY     &amp; PERFORMANCEThe CGR 725 is a hugely capable multi-terrain gravel bike. Designed around the elegant, ride smoothing, and infinitely rugged Reynolds 725 steel frameset is a package that offers incredible performance, durability and versatility. Shimano’s 105 groupset is the entry point into 11-speed shifting and has established itself as the most popular choice on the market today. This is in no small part thanks to its exceptionally smooth, precision shifting performance and incredible value.Mavic’s ever-reliable Aksium wheelset shod with Schwalbe G-One 40mm tyres offer impressive year-round traction and reliability. With its generous tyre clearance, plus mudguard and rack compatibility, the CGR 725 is designed to excel both on and off-road and across a variety of surfaces.",Cycling,1999.00,"Ribble Cycles",5923,252,https://images2.productserve.com/?w=200&h=200&bg=white&trim=5&t=letterbox&url=ssl%3Acheckout.ribblecycles.co.uk%2Fmedia%2Fcatalog%2Fproduct%2Fc%2Fg%2Fcgr725_enthus_cut_side_on.png&feedId=5923&k=7ec7d84ce3c51b7c397b537de545e05d84f97259,,40.00,GBP1999.00,,,,,,
