aw_deep_link,product_name,aw_product_id,merchant_product_id,merchant_image_url,description,merchant_category,search_price,merchant_name,merchant_id,category_id,aw_image_url,store_price,delivery_cost,display_price,ean,isbn,upc,mpn,parent_product_id,product_GTIN
https://www.awin1.com/pclick.php?p=32153271181&a=87679&m=5923,"Restrap Saddle Bag + Dry Bag Large (14litre)",32153271181,RESTBAGS201BKBKLG14L,https://checkout.ribblecycles.co.uk/media/catalog/product/s/a/saddle10_1024x1024_-_copy.jpg,"Saddle Bag + Dry Bag Large (14litre)",Cycling,99.99,"Ribble Cycles",5923,252,https://images2.productserve.com/?w=200&h=200&bg=white&trim=5&t=letterbox&url=ssl%3Acheckout.ribblecycles.co.uk%2Fmedia%2Fcatalog%2Fproduct%2Fs%2Fa%2Fsaddle10_1024x1024_-_copy.jpg&feedId=5923&k=0cd3a353248ab3b7a5f103ad94d7724173c8cfa5,,3.00,GBP99.99,,,,,,
https://www.awin1.com/pclick.php?p=32153271185&a=87679&m=5923,"Restrap Frame Bag Black Medium",32153271185,RESTBAGS203BK00B00MD,https://checkout.ribblecycles.co.uk/media/catalog/product/f/r/framebags06_dbd065c6-7b6f-4030-91c9-db1c26a2661a_1024x1024.jpg,"Frame Bag Black Medium",Cycling,54.99,"Ribble Cycles",5923,252,https://images2.productserve.com/?w=200&h=200&bg=white&trim=5&t=letterbox&url=ssl%3Acheckout.ribblecycles.co.uk%2Fmedia%2Fcatalog%2Fproduct%2Ff%2Fr%2Fframebags06_dbd065c6-7b6f-4030-91c9-db1c26a2661a_1024x1024.jpg&feedId=5923&k=c6261c9ed555f4004849ad1aedee59f157c4968d,,3.00,GBP54.99,,,,,,
https://www.awin1.com/pclick.php?p=32071604209&a=87679&m=5923,"Restrap Frame Bag Black Small",32071604209,RESTBAGS202BK00A00SM,https://checkout.ribblecycles.co.uk/media/catalog/product/f/r/framebags02_1024x1024.jpg,"Frame Bag Black Small",Cycling,39.99,"Ribble Cycles",5923,252,https://images2.productserve.com/?w=200&h=200&bg=white&trim=5&t=letterbox&url=ssl%3Acheckout.ribblecycles.co.uk%2Fmedia%2Fcatalog%2Fproduct%2Ff%2Fr%2Fframebags02_1024x1024.jpg&feedId=5923&k=c584c20869096628e53b0dda1d5656415bbe16f8,,3.00,GBP39.99,,,,,,
https://www.awin1.com/pclick.php?p=32919597539&a=87679&m=5923,"Ribble Endurance SL Disc & CX SL Mudguard Bridge Black",32919597539,RIBBFRAZ155NOCLONESZ,https://checkout.ribblecycles.co.uk/media/catalog/product/w/m/wmc09092.png,"Removable Mudguard Bridge for Endurance SL DiscSimple and easy to use - This mudguard bridge mounts in seconds and enables full coverage mudguards to be fitted to the Endurance SL Disc for enhanced protection from the elements.Lightweight, 3D printed designSimple to fit, and easy to removeCompatible with the Endurance SL Disc model only.",Cycling,19.99,"Ribble Cycles",5923,252,https://images2.productserve.com/?w=200&h=200&bg=white&trim=5&t=letterbox&url=ssl%3Acheckout.ribblecycles.co.uk%2Fmedia%2Fcatalog%2Fproduct%2Fw%2Fm%2Fwmc09092.png&feedId=5923&k=ab34d2032d2c0e6e44ecc8839306f71aea50a3df,,3.00,GBP19.99,,,,,,
https://www.awin1.com/pclick.php?p=32919597541&a=87679&m=5923,"Ribble Ultra Tri Disc Rear Mech Hanger",32919597541,RIBBFRAZ629000000000,,"ULTRA TRI DISC Mech Hanger",Cycling,19.99,"Ribble Cycles",5923,252,https://images2.productserve.com/noimage.gif,,3.00,GBP19.99,,,,,,
https://www.awin1.com/pclick.php?p=30881050011&a=87679&m=5923,"Ribble CGR Ti / Adventure Ti Mech Hanger",30881050011,RIBBFRAZ540BK00ONESZ,https://checkout.ribblecycles.co.uk/media/catalog/product/r/i/ribbfraz540.jpg,"CGR Ti - Adventure Ti Mech HangerA perfectly aligned derailleur hanger is essential to maintaining the smooth and efficient performance of your drivetrain. This dependable CNC machined replacement gear hanger is designed exclusively to fit Ribble Titanium frames equipped with disc brakes and bolt thru-axles. Compatible with the following models only;CGR TitaniumAdventure Titanium Please compare your existing hanger to that pictured to ensure correct fitting.",Cycling,19.99,"Ribble Cycles",5923,252,https://images2.productserve.com/?w=200&h=200&bg=white&trim=5&t=letterbox&url=ssl%3Acheckout.ribblecycles.co.uk%2Fmedia%2Fcatalog%2Fproduct%2Fr%2Fi%2Fribbfraz540.jpg&feedId=5923&k=5952c655c47a6bcc71b99bdbcf6f1cbfb0f46237,,3.00,GBP19.99,,,,,,
https://www.awin1.com/pclick.php?p=29805728783&a=87679&m=5923,"DMR Vault Pedals Black",29805728783,DMRAPEDM210BK0000000,https://checkout.ribblecycles.co.uk/media/catalog/product/v/a/vault-black_1.jpg,"Vault PedalsThe DMR Vault pedal is a tuneable flat pedal designed specifically for riders who want a bigger platform. Equally at home on an all mountain or downhill setup, the DMR Vault pedal offers great stability and grip for the bumpiest of trailsFeaturesLarge &amp;ndash; 105mm * 105mm (Platform area)Light &amp;ndash; 400g per pairSlim &amp;ndash; 17mm concave foot bedTough &amp;ndash; Extruded 6061 Aluminium and 4140 Cro-mo Steel axles (9/16&amp;Prime;)Tuneable &amp;ndash; 11 pins per Vault pedal. Flip the pins to fine-tune the gripServiceable &amp;ndash; High load DU bush and cartridge bearing'Shape, depth and pin placement are the qualities that makes the Vault pedal a winner and a favourite on many of our personal bikes here at Dirt' - Dirt Magazine",Cycling,100.00,"Ribble Cycles",5923,252,https://images2.productserve.com/?w=200&h=200&bg=white&trim=5&t=letterbox&url=ssl%3Acheckout.ribblecycles.co.uk%2Fmedia%2Fcatalog%2Fproduct%2Fv%2Fa%2Fvault-black_1.jpg&feedId=5923&k=555496e7e8b4b7dd224c02213399d471ff8ebfa3,,3.00,GBP100.00,,,,,,
https://www.awin1.com/pclick.php?p=33125870905&a=87679&m=5923,"CSN Star Headset Washer/Nut Set",33125870905,CSNAHSTZ200,https://checkout.ribblecycles.co.uk/media/catalog/product/C/S/CSNAHSTZ200_1_ZOOM.jpg,"Star nut grips firmly inside the steerer tube when tightened- Not recommended for use with forks with a carbon steering tube (use carbon expanding stem cap)- The countersunk cap and bolt design minimises the risk of it loosening when in use-",Cycling,2.76,"Ribble Cycles",5923,252,https://images2.productserve.com/?w=200&h=200&bg=white&trim=5&t=letterbox&url=ssl%3Acheckout.ribblecycles.co.uk%2Fmedia%2Fcatalog%2Fproduct%2FC%2FS%2FCSNAHSTZ200_1_ZOOM.jpg&feedId=5923&k=4e59ffc419d51e78dcfe21a6fd725e05c7ace870,,3.00,GBP2.76,,,,,,
https://www.awin1.com/pclick.php?p=33125870907&a=87679&m=5923,"Ribble CX5 Headset",33125870907,RIBBHSTR360000000000,,"CX5 Headset 1 1/8 - 1 1/4Replacement headset for the Ribble CX5Includes bearings to keep your steering running as smoothly as possible",Cycling,19.99,"Ribble Cycles",5923,252,https://images2.productserve.com/noimage.gif,,3.00,GBP19.99,,,,,,
https://www.awin1.com/pclick.php?p=33125870909&a=87679&m=5923,"Hope F20 Flat Pedals",33125870909,HOPEPEDM200,https://checkout.ribblecycles.co.uk/media/catalog/product/h/o/hopepedm200-1_1_1.jpg,"F20 Flat PedalsPedals feature a fully CNC machined platform out of 2014 T6 aluminium with anodised finishThe axle is made of high strength Cr-Mo, heat treated and platedThe platform is slightly concave in shape to give maximum supportEach pedal uses a norglide bush and three cartridge bearings in a fully sealed chamber to give a long smooth lifeReplaceable pins per pedal provide excellent traction and grip",Cycling,120.00,"Ribble Cycles",5923,252,https://images2.productserve.com/?w=200&h=200&bg=white&trim=5&t=letterbox&url=ssl%3Acheckout.ribblecycles.co.uk%2Fmedia%2Fcatalog%2Fproduct%2Fh%2Fo%2Fhopepedm200-1_1_1.jpg&feedId=5923&k=a7321df7cdf3fd6e51e28db97e4cdfea5cccf9fd,,3.00,GBP120.00,,,,,,
https://www.awin1.com/pclick.php?p=33125870911&a=87679&m=5923,"DMR V8 Pedals v2",33125870911,DMRAPEDM200,https://checkout.ribblecycles.co.uk/media/catalog/product/v/8/v8-black_1_1.jpg,"V8 Pedals v2New and updated DMR V8 pedal design for 2017!&amp;nbsp;Sharing the concave shape and durability that the iconic DMR V8 pedals became famous for, the new version has a larger platform area and serviceable Dual DU bushing systemThe new DMR V8 pins can be tuned for preferred grip and feel. Available in a range of colours.Large Platform AreaUltra-Low Profile480g Per PairServiceable Dual DU Bush System10 Tuneable Pins Per SideHeavy Duty 4140 Cro.Mo Steel AxlesDie Cast Aluminium Body",Cycling,38.00,"Ribble Cycles",5923,252,https://images2.productserve.com/?w=200&h=200&bg=white&trim=5&t=letterbox&url=ssl%3Acheckout.ribblecycles.co.uk%2Fmedia%2Fcatalog%2Fproduct%2Fv%2F8%2Fv8-black_1_1.jpg&feedId=5923&k=c2e304f347a452df8cbb4046e85a586130cdfa84,,3.00,GBP38.00,,,,,,
https://www.awin1.com/pclick.php?p=33125870913&a=87679&m=5923,"DMR V12 Pedals",33125870913,DMRAPEDM205,https://checkout.ribblecycles.co.uk/media/catalog/product/v/1/v12-black_1_1.jpg,"V12 PedalsOver its 18 years of production the DMR V12 has become recognized as the benchmark for flat pedal performance. We took our iconic V12 body design and redefined it.Larger Platform AreaThe new DMR V12 offers 10% more surface area than the classic shape. This means better grip and also support for rougher conditions and bigger hits.Lower ProfileAt just 16mm deep the V12 is as slim as we could go whilst still retaining our legendary concave feel.Lighter WeightThere is a 20% weight saving from the last V12 with the standard version weighing under 430g per pair and the Magnesium at just 350g.The V12 runs on fully sealed bearings and a cro-mo axle. All pins on the pedal are replaceable and tuneable for preferred grip.SpecifiationSealed Bearings&amp;nbsp;Cro-Mo AxleClassic DMR Concave",Cycling,50.00,"Ribble Cycles",5923,252,https://images2.productserve.com/?w=200&h=200&bg=white&trim=5&t=letterbox&url=ssl%3Acheckout.ribblecycles.co.uk%2Fmedia%2Fcatalog%2Fproduct%2Fv%2F1%2Fv12-black_1_1.jpg&feedId=5923&k=881c03d9e8ac5177be9dfe48941ba4e6382c13df,,3.00,GBP50.00,,,,,,
https://www.awin1.com/pclick.php?p=33125870915&a=87679&m=5923,"DMR V12 Mag Pedals",33125870915,DMRAPEDM207,https://checkout.ribblecycles.co.uk/media/catalog/product/v/1/v12mag-black_1_1.jpg,"V12 Mag PedalsOver its 18 years of production the V12 has become recognized as the benchmark for flat pedal performance. We took our iconic V12 body design and redefined it. The DMR V12 Magnesium is the Light-weight Magnesium version of the standard V12.Larger Platform AreaThe new DMR V12 Magnesium [Mg] offers 10% more surface area than the classic shape. This means better grip and also support for rougher conditions and bigger hits.Lower ProfileAt just 16mm deep the V12 is as slim as we could go whilst still retaining our legendary concave feel.Lighter WeightThere is a 20% weight saving from the last V12 with the standard version weighing under 430g per pair and the Magnesium at just 350g.The V12 runs on fully sealed bearings and a cro-mo axle. All pins on the pedal are replaceable and tuneable for preferred grip.SpecificationFully sealed bearingsCro-mo axleReplaceable pins350g per pair",Cycling,62.99,"Ribble Cycles",5923,252,https://images2.productserve.com/?w=200&h=200&bg=white&trim=5&t=letterbox&url=ssl%3Acheckout.ribblecycles.co.uk%2Fmedia%2Fcatalog%2Fproduct%2Fv%2F1%2Fv12mag-black_1_1.jpg&feedId=5923&k=fbca8086b1f44328fe64213374fb9ac2adb5e5b3,,3.00,GBP62.99,,,,,,
https://www.awin1.com/pclick.php?p=33125870917&a=87679&m=5923,"Restrap Bar Bag + Food Pouch + Dry Bag Black - Small",33125870917,RESTBAGB200BK00ONESZ,https://checkout.ribblecycles.co.uk/media/catalog/product/b/a/barbag10_1.jpg,"Restrap Bar Bag + Food Pouch + Dry BagRestrap's #carryeverything rack-less bar bag connects securely to your handle bars for bike packing, touring or commuting. With no mounts or screws, the bag attaches in seconds to any bike. The holster fits up to a 14 litre dry bag and is secured with a patented magnetic buckle that&amp;rsquo;s easy to adjust, even whilst wearing gloves. The bag is hardcase for easy loading and made from 1000D military-grade cordura and with nylon webbing for extra strength. Your stuff is held securely, even at speed. Contains a magnetic pin system for add-on food pouchSize:&amp;nbsp;14 litre double roll includedMade: 100% handmade in Yorkshire, England",Cycling,84.99,"Ribble Cycles",5923,252,https://images2.productserve.com/?w=200&h=200&bg=white&trim=5&t=letterbox&url=ssl%3Acheckout.ribblecycles.co.uk%2Fmedia%2Fcatalog%2Fproduct%2Fb%2Fa%2Fbarbag10_1.jpg&feedId=5923&k=9ec597e9b5b255cf7c77204f34bfbef694c2a632,,3.00,GBP84.99,,,,,,
https://www.awin1.com/pclick.php?p=33125870919&a=87679&m=5923,"Ribble Brake Bolt for Ultra TT One Size",33125870919,RIBBBRZZ100NOCLONESZ,https://checkout.ribblecycles.co.uk/media/catalog/product/r/i/ribbbrzz100noclonesz.jpg,"Ultra TT Brake BoltDesigned specifically for mounting TRP T860/T861 aero brakes to the Ultra TT frameset and includes the additional small bolt which enables a TRP aero brake cover to be bolted onto the brakes.",Cycling,14.30,"Ribble Cycles",5923,252,https://images2.productserve.com/?w=200&h=200&bg=white&trim=5&t=letterbox&url=ssl%3Acheckout.ribblecycles.co.uk%2Fmedia%2Fcatalog%2Fproduct%2Fr%2Fi%2Fribbbrzz100noclonesz.jpg&feedId=5923&k=08c9e6650e220a8f508612de9d2acb9ec49d1e22,,3.00,GBP14.30,,,,,,
https://www.awin1.com/pclick.php?p=33125870921&a=87679&m=5923,"Ribble Bike Spray Bundle",33125870921,BDESRIBB005,https://checkout.ribblecycles.co.uk/media/catalog/product/b/d/bdl_1_1.jpg,"Ribble Bike Spray BundleBike Cleaner Spray and Bike Protector SprayIncludes:Ribble Bike Protector Spray 750mlRibble Bike Cleaner Spray 750mlRibble Bike ProtectorA high performance protection fluid in a convenient spray bottle scientifically formulated to protect your bike from all cycling environments. Designed for use after cleaning your bike it will leave your bike shining like new, protected from dirt and corrosion, and working at its best, all of the time.Safe to use all over the bike and on any materials including carbon, aluminium, steel, titanium and on all paintwork.We also recommend the Ribble Bike Cleaner to use before applying this protector.Next Day and Tracked Delivery options available.Features750ml.Integral spray nozzle.Perfect for all bikes.Ribble workshop tipRibble workshop tip from Head Mechanic Mark: &amp;ldquo;When cleaning your bike it&amp;rsquo;s best to tackle the chain first, before the rest of the bike, as it&amp;rsquo;s usually the dirtiest job but a proper chain cleaner and degreaser makes things much easier.&amp;rdquo;Tackle your chain first with the Ribble Chain Cleaner.Ribble Bike CleanerA high performance bike cleaner in a convenient spray bottle specifically formulated for the rigours of all year cycling. It provides your entire bike with a deep clean and is effective on dirt, sand, oil, grease and insects.With a unique scented formula it offers the complete cleaning solution, ensuring all components are kept in peak condition. The unique formula is biodegradable.Safe to use on all materials including carbon, aluminium, steel, titanium and all paintwork. Once you have cleaned your bike, use the&amp;nbsp;Ribble Bike Protector&amp;nbsp;to keep it looking its best.Next Day and Tracked Delivery options available.Features750ml.Biodegradable.Integral spray nozzle.Perfect for all bikes.About RibbleFounded in 1887, Ribble Cycles continues to be at the very heart of British cycling. From award-winning bikes to innovative clothing and accessories, our long cycling heritage means that we truly understand your needs. Created by cyclists for cyclists.",Cycling,9.99,"Ribble Cycles",5923,252,https://images2.productserve.com/?w=200&h=200&bg=white&trim=5&t=letterbox&url=ssl%3Acheckout.ribblecycles.co.uk%2Fmedia%2Fcatalog%2Fproduct%2Fb%2Fd%2Fbdl_1_1.jpg&feedId=5923&k=8574ac2d235b01ebaee229183efff074e2a82233,,3.00,GBP9.99,,,,,,
https://www.awin1.com/pclick.php?p=33125870923&a=87679&m=5923,"Ribble Rear Mech Hanger for Carbon Disc Frames Black",33125870923,RIBBFRAZ120NOCLONESZ,https://checkout.ribblecycles.co.uk/media/catalog/product/d/i/disc_hanger_1.jpg,"Ribble 2019 Carbon Mech Hanger (Disc) One Size - A genuine Ribble replacement part - Derailleur Hanger to fit Ribble Carbon frames with Disc Brakes and Bolt Thru-Axles. Compatible with;CGR SL CarbonEndurance SL DiscEndurance SL R DiscCX SL.",Cycling,19.99,"Ribble Cycles",5923,252,https://images2.productserve.com/?w=200&h=200&bg=white&trim=5&t=letterbox&url=ssl%3Acheckout.ribblecycles.co.uk%2Fmedia%2Fcatalog%2Fproduct%2Fd%2Fi%2Fdisc_hanger_1.jpg&feedId=5923&k=eb6da2082c6bb39284cf6e0767ad0af77261853c,,3.00,GBP19.99,,,,,,
https://www.awin1.com/pclick.php?p=33125870933&a=87679&m=5923,"Ribble Ultra Tri Disc Water Bottle",33125870933,RIBBFRAZ495,https://checkout.ribblecycles.co.uk/media/catalog/product/r/i/ribbfraz495_aerobars_drinkbox__sw.jpg,"Ultra Tri Water BottleHydration system to fit the Ribble Ultra Tri.Size Specific: Please choose the correct bottle size to suit your frame size.",Cycling,99999.00,"Ribble Cycles",5923,252,https://images2.productserve.com/?w=200&h=200&bg=white&trim=5&t=letterbox&url=ssl%3Acheckout.ribblecycles.co.uk%2Fmedia%2Fcatalog%2Fproduct%2Fr%2Fi%2Fribbfraz495_aerobars_drinkbox__sw.jpg&feedId=5923&k=59d591a2eb163bed28241e4bca51b09ef18e1b79,,3.00,GBP99999.00,,,,,,
https://www.awin1.com/pclick.php?p=33125870935&a=87679&m=5923,"Ribble Endurance SL R Disc",33125870935,BBROADCL000,https://checkout.ribblecycles.co.uk/media/catalog/product/e/n/endurance_slr_di2_12_speed_side_on_1_.png,"The Endurance SL R is our flagship carbon endurance bike, this high-performance frameset is superlight (frame sub 900g) and the truncated aerofoil profile of the tubes makes it the lightest and one of the fastest packages that we offer.",Cycling,2999.00,"Ribble Cycles",5923,252,https://images2.productserve.com/?w=200&h=200&bg=white&trim=5&t=letterbox&url=ssl%3Acheckout.ribblecycles.co.uk%2Fmedia%2Fcatalog%2Fproduct%2Fe%2Fn%2Fendurance_slr_di2_12_speed_side_on_1_.png&feedId=5923&k=00d9f702f703b8c043303e328c01321634817d05,,40.00,GBP2999.00,,,,,,
https://www.awin1.com/pclick.php?p=33125870937&a=87679&m=5923,"Ribble Endurance SL R",33125870937,BBROADCX000,https://checkout.ribblecycles.co.uk/media/catalog/product/e/n/endurance_sl_r_black_pro_da_di2_side_on_2_1.png,"The new Ribble Endurance SL R sits atop the Ribble Endurance road bikes range and is world class road platform designed for Endurance riding and racing.",Cycling,2599.00,"Ribble Cycles",5923,252,https://images2.productserve.com/?w=200&h=200&bg=white&trim=5&t=letterbox&url=ssl%3Acheckout.ribblecycles.co.uk%2Fmedia%2Fcatalog%2Fproduct%2Fe%2Fn%2Fendurance_sl_r_black_pro_da_di2_side_on_2_1.png&feedId=5923&k=fd6e19c528cb1da28dda7377520480ad495d3a4a,,40.00,GBP2599.00,,,,,,
https://www.awin1.com/pclick.php?p=33125870939&a=87679&m=5923,"Ribble Endurance SL Disc",33125870939,BBROADCD000,https://checkout.ribblecycles.co.uk/media/catalog/product/e/n/endurance-sl-red-di2-12-speed_gallery_side_on.png,"The new Ribble Endurance SL Disc is a superlight road platform designed for Endurance riding and racing.",Cycling,2099.00,"Ribble Cycles",5923,252,https://images2.productserve.com/?w=200&h=200&bg=white&trim=5&t=letterbox&url=ssl%3Acheckout.ribblecycles.co.uk%2Fmedia%2Fcatalog%2Fproduct%2Fe%2Fn%2Fendurance-sl-red-di2-12-speed_gallery_side_on.png&feedId=5923&k=a789e054ff08efcd9b98ec14a3a670d48e97d23f,,40.00,GBP2099.00,,,,,,
https://www.awin1.com/pclick.php?p=33125870941&a=87679&m=5923,"Ribble Endurance AL Disc",33125870941,BBROADDA000,https://checkout.ribblecycles.co.uk/media/catalog/product/e/n/endurance-al-disc_antracite_105_side-on_1_2.png,"Light, agile, and comfortable the Endurance AL lends itself superbly to fast-paced rides short or long. The aspiring racer, weekend hero, and daily commuter can experience that exhilarating ride feel that you only get from a high-end alloy road bike.",Cycling,1099.00,"Ribble Cycles",5923,252,https://images2.productserve.com/?w=200&h=200&bg=white&trim=5&t=letterbox&url=ssl%3Acheckout.ribblecycles.co.uk%2Fmedia%2Fcatalog%2Fproduct%2Fe%2Fn%2Fendurance-al-disc_antracite_105_side-on_1_2.png&feedId=5923&k=f578736db9ae1fd416fc0bac0db1d42b4749b88d,,40.00,GBP1099.00,,,,,,
https://www.awin1.com/pclick.php?p=33125870943&a=87679&m=5923,"Ribble CGR SL",33125870943,BBCGRCAA000,https://checkout.ribblecycles.co.uk/media/catalog/product/r/i/ribble_cgr_sl_carbon_cross_gravel_road_bike.png,"The all new Ribble CGR SL is the ultimate in lightweight, high performance, rugged, versatility. The CGR SL range can take you anywhere from the highest mountain passes, distant trails or your most imaginative daily commute.",Cycling,1799.00,"Ribble Cycles",5923,252,https://images2.productserve.com/?w=200&h=200&bg=white&trim=5&t=letterbox&url=ssl%3Acheckout.ribblecycles.co.uk%2Fmedia%2Fcatalog%2Fproduct%2Fr%2Fi%2Fribble_cgr_sl_carbon_cross_gravel_road_bike.png&feedId=5923&k=bd807deeb5c7a224c9e57d514fccad47c8080fb8,,40.00,GBP1799.00,,,,,,
https://www.awin1.com/pclick.php?p=33125870945&a=87679&m=5923,"Ribble CX AL",33125870945,BBCXDARD000,https://checkout.ribblecycles.co.uk/media/catalog/product/c/x/cx_red_apex_disc__side-web_1.png,"The CX AL is a highly versatile all-road bike, it's ideal for those entering the world of cyclocross for the first time but can also be finely tuned to function as a gravel or road bike. With confident handling, lightning-fast acceleration and outstanding traction this is a thoroughbred racing machine.",Cycling,1399.00,"Ribble Cycles",5923,252,https://images2.productserve.com/?w=200&h=200&bg=white&trim=5&t=letterbox&url=ssl%3Acheckout.ribblecycles.co.uk%2Fmedia%2Fcatalog%2Fproduct%2Fc%2Fx%2Fcx_red_apex_disc__side-web_1.png&feedId=5923&k=9318630b02d56952485458a7ae84d91f3def4f80,,40.00,GBP1399.00,,,,,,
https://www.awin1.com/pclick.php?p=33125870947&a=87679&m=5923,"Ribble Hybrid AL",33125870947,BBURBAAA000,https://checkout.ribblecycles.co.uk/media/catalog/product/h/y/hybrid-leisure-fully-loaded-small_1.png,"The Ribble Hybrid Road build is ideal for the city commuter or road focused leisure rider who is looking for a stylish, high quality, lightweight bike that offers speed, comfort and great handling in all weather conditions.",Cycling,1099.00,"Ribble Cycles",5923,252,https://images2.productserve.com/?w=200&h=200&bg=white&trim=5&t=letterbox&url=ssl%3Acheckout.ribblecycles.co.uk%2Fmedia%2Fcatalog%2Fproduct%2Fh%2Fy%2Fhybrid-leisure-fully-loaded-small_1.png&feedId=5923&k=2152383a24b29948a9c2d99cb334bc1bbdfcecaf,,40.00,GBP1099.00,,,,,,
https://www.awin1.com/pclick.php?p=33125870949&a=87679&m=5923,"Ribble Hybrid Trail AL",33125870949,BBURMAAA000,https://checkout.ribblecycles.co.uk/media/catalog/product/h/y/hybrid_trial__side_on_1.png,"Perfect for fitness or fun, the Hybrid Trail is a stylish and versatile bike that is designed for mixed road and off-road riding. Combining the speed and efficiency of a road bike with the relaxed riding position of an MTB, with front suspension to soak up the bumps, the Hybrid AL injects a sense of adventure into your daily routine.",Cycling,899.00,"Ribble Cycles",5923,252,https://images2.productserve.com/?w=200&h=200&bg=white&trim=5&t=letterbox&url=ssl%3Acheckout.ribblecycles.co.uk%2Fmedia%2Fcatalog%2Fproduct%2Fh%2Fy%2Fhybrid_trial__side_on_1.png&feedId=5923&k=650250006ef94d019c67064db26c0ab15bcfb9dc,,40.00,GBP899.00,,,,,,
